	PhraseId	SentenceId	Phrase	Sentiment
1885	107086.0	5657	good rememb	3.25
1886	107557.0	5684	although film boil down lightweight stori matchmak	2.0
1887	42706.0	2062	cute ami career success lrb bestsel writer selfhelp book ca nt help rrb ami neuros come men	2.0
1888	113075.0	6005	best lrb doe veri funni sequenc rrb look leonard remind comic subvers silenc	2.0
1889	112399.0	5970	k19 widowmak deriv overlong bombast yet surprisingli entertain	3.0
1890	132099.0	7123	schepisi aid cast seem includ everi topnotch british actor not appear in gosford park lrb well one ms mirren rrb ha succeed beyond expect	4.0
1891	83642.0	4324	obnoxi special effect obligatori outburst flatul incess sofiveminutesago pop music soundtrack	1.0
1892	97633.0	5109	nt go straight video	2.0
1893	54636.0	2719	take ani 12yearold boy see thi pictur slave year	3.5
1894	37495.0	1781	start potenti incred twist mysteri becom simpli monster chase film	1.0
1895	50214.0	2468	sometim shorter better	2.0
1896	75878.0	3893	plummer steal show without resort camp nichola wound wound uncl ralph	3.0
1897	31437.0	1471	droll whimsi	1.5
1898	65683.0	3329	thi unrel bleak insist opt out ani opportun find mean in relationship work becom sad	2.0
1899	102051.0	5372	quasidocumentari french filmmak karim dridi celebr hardi spirit cuban music	3.0
1900	80967.0	4173	everyth seriou poetic earnest sadli dull	1.0
1901	53547.0	2655	saw enjoy	4.0
1902	128194.0	6898	import exhilar form anim filmmak sinc old walt	3.0
1903	137229.0	7424	film overal mood focu interest constantli unfulfil	2.0
1904	150642.0	8211	thi mess movi noth short travesti transvestit comedi	0.0
1905	137444.0	7436	lame comedi	0.0
1906	136342.0	7371	thrill eye in overthetop way touch heart	3.0
1907	42761.0	2064	brim coltish neurot energi hold screen like true star	3.0
1908	118579.0	6337	episod ii attack clone technolog exercis lack juic delight	1.0
1909	61724.0	3120	resolut cobbl togeth out older movi even use total unnecessari prologu becaus seem obligatori	1.0
1910	34129.0	1603	wit necessari fulli exploit comic element premis make proceed bizarr actual amus	2.0
1911	98615.0	5169	adventur happen along way seem repetit design fill time provid no real sens suspens	1.0
1912	144315.0	7835	sayl onc strand hi superb perform in old stori	1.0
1913	155837.0	8531	even no interest in ganginfest eastv	2.0
1914	87810.0	4561	captur moment woman life out deepseat emot need turn onto differ path	3.0
1915	118856.0	6352	pain loneli insecur screenwrit process vividli pain brought slovenli life in thi selfdeprec bite witti featur written charli kaufman hi twin brother donald direct spike jonz	3.0
1916	154552.0	8449	staggeringli dread romanc	0.0
1917	20791.0	928	contrast neither dramat comic weird fizzl	1.0
1918	3038.0	114	stir visual sequenc like surg swirl rapid leap pinnacl pinnacl rous us	3.0
1919	62108.0	3140	ingeni film comedi sinc john malkovich	4.0
1920	8645.0	359	not good origin	2.0
1921	45739.0	2224	tri thi obscen bad dark comedi crass make edward burn sidewalk new york look like oscar wild	1.0
1922	80222.0	4134	someth must lost in translat	1.0
1923	90068.0	4688	despit raucou intent xxx convent nike ad rebelli spring break	2.0
1924	128623.0	6918	raw vital give consider punch	3.0
1925	126974.0	6827	painless timekil becom instead grate endur test	1.0
1926	153851.0	8404	movi contriv lame screenplay	0.0
1927	17617.0	763	fessenden narr much ownership redefinit myth domest unit find way joy	3.0
1928	88562.0	4601	success adapt enjoy film in right	3.6666666666666665
1929	12035.0	517	intellig multilay profoundli humanist lrb not mention gentli polit rrb medit valu knowledg educ affect cultur geograph displac	4.0
1930	29038.0	1345	though frida easier swallow juli taymor preposter titu	2.0
1931	30405.0	1411	toward end sum fear morph mundan 70 disast flick	1.0
1932	87573.0	4546	sum fear simpli wellmad satisfi thriller	4.0
1933	107324.0	5672	bit themat meat bone queen damn origin in ann rice novel dictat gener movi emphas style over charact substanc	2.0
1934	114458.0	6089	invent silli like wit in movi theatr time	3.0
1935	64429.0	3262	onelin snappi situat volatil comic opportun richli reward	4.0
1936	31666.0	1484	uplift funni wise	3.0
1937	148146.0	8062	lumpi twoday old porridg filmmak paw sad say over thi unbear project	0.0
1938	130927.0	7057	meyj focus too much max fill screen thi tortur dull artist monsterinth make	2.0
1939	126221.0	6784	differ movi sometim tediou director mani viewer would like skip film buff get know	3.0
1940	99838.0	5238	someth seem miss	2.0
1941	74695.0	3830	dark tragic let busi greedi talent agent get in way say someth meaning face death	2.0
1942	126370.0	6794	nadia birthday might not bad day	2.5
1943	11425.0	490	rivet handsom	3.0
1944	133693.0	7212	too contriv natur charm need	1.6666666666666667
1945	115754.0	6169	satisfyingli odd intrigu tale wa centuri half ago ha delight dour deadpan tone stylist consist	4.0
1946	136733.0	7394	take complet moron foul up screen adapt oscar wild classic satir	1.0
1947	44189.0	2143	sunshin state survey landscap assess issu clear passion sociolog	2.0
1948	56467.0	2835	stori predict joke typic sandler fare romanc ryder puzzl	1.0
1949	30752.0	1431	sour littl movi core explor empti underlay relentless gaieti 1920	1.0
1950	120537.0	6446	not much fatal outsid stylish surpris ok	2.0
1951	89623.0	4662	pure composit	3.0
1952	72286.0	3695	well jason gone manhattan hell guess space station in year 2455 cross list idea inevit futur sequel lrb hey nt shoot messeng rrb	1.0
1953	125358.0	6736	onli thing laugh peopl paid see	1.0
1954	24262.0	1103	wonder combin sweet extraordinari technic accomplish first film maintain overal impact fall littl flat storylin never quit deliv origin magic	2.0
1955	20764.0	927	onli sexi danger actress in role remind everi turn elizabeth berkley flop dolphingasm	1.0
1956	17250.0	749	offer interest bit specul issu brecht face hi life drew close	3.0
1957	122948.0	6598	fairli harmless ultim lifeless featurelength afterschool special	1.0
1958	111852.0	5937	code talker deserv better hollow tribut	1.0
1959	116807.0	6232	compel horrifi stori larami project worthwhil remind us thi sort thing doe in fact still happen in america	3.5
1960	1922.0	71	ambit say someth subject not willing	2.0
1961	50254.0	2470	citizen kane	2.0
1962	21391.0	956	invigor doe nt give damn	3.0
1963	88313.0	4587	everett remain perfect wildean actor relax firth display impecc comic skill	3.5
1964	111874.0	5939	sinc movi base nichola spark best seller know death lurk around corner wait spoil thing	2.0
1965	77926.0	4010	eleg eloqu lrb medit rrb death elus passion love	4.0
1966	46283.0	2252	poorli script preachi fabl forget unfold coher believ stori in zeal spread propaganda	2.0
1967	83157.0	4293	ha thank ditch saccharin sentiment bicentenni man in favour altogeth darker side	3.0
1968	20729.0	925	anoth trumpet blast may new mexican cinema abornin	3.0
1969	138874.0	7527	movi equival french hiphop also seem play 10year delay	0.0
1970	143814.0	7805	summer far too fleet squander offal like thi	2.0
1971	63901.0	3233	not bad premis execut lacklust best	2.0
1972	121669.0	6520	critic never rise abov easi cynic potshot moral bankrupt charact	1.0
1973	72525.0	3705	jacki chan movi guilti pleasur easi like alway leav us laugh	3.0
1974	17817.0	773	charlott sometim gem	3.0
1975	44662.0	2165	time spend peopl never realli get insid	1.0
1976	134437.0	7252	feel in almost everi possibl way write direct soggi perform toss	0.0
1977	107970.0	5712	feel inmat actual taken over asylum	2.0
1978	28761.0	1333	movi remark dull onli cain make much impress	1.0
1979	71024.0	3622	perform move heartbreak rebellion continu tri accommod fit in gain uncondit love seek	3.0
1980	68829.0	3496	captiv show skill filmmak impart messag without bludgeon audienc over head	4.0
1981	26033.0	1191	none thi ha suaviti classic familiar bond much good laugh	2.0
1982	63584.0	3219	would even indistinct not strike quietli vulner person ms ambros	2.0
1983	128705.0	6923	ryan gosl 22 power young actor	4.0
1984	109921.0	5823	done like much better first time around wa call profession	1.0
1985	12228.0	523	highli recommend engross stori horrifi histor event element contribut	3.0
1986	83967.0	4339	gentli funni sweetli adventur film make feel genuin good say entir uncon fals sentiment sharp overmanipul hollywood practic	3.0
1987	120465.0	6441	thurman lewi give easili consid careerbest perform	4.0
1988	95105.0	4960	disguis fact new film lame kiddi flick carvey consider talent wast in	0.5
1989	32271.0	1514	terri sort geriatr dirti harri pleas eastwood loyal fan suit stori wherein hero must ride roughshod over incompet cop get hi man	3.0
1990	146896.0	7993	highli watchabl giggli littl stori	4.0
1991	85802.0	4440	crudup screen presenc one thing hold interest in midst mushi existenti explor whi men leav famili	3.0
1992	133518.0	7204	clever script skill actor bring new energi familiar topic offic polit	3.0
1993	78856.0	4058	action sequenc clearli main event	3.0
1994	144271.0	7832	darkli funni frequent insight	3.0
1995	37516.0	1783	characteris ha sacrif sake spectacl	0.0
1996	70320.0	3584	nt need hiphop fan appreci scratch mark documentari work	3.5
1997	87448.0	4537	problem movi ha no idea seriou not	1.0
1998	149014.0	8108	none thi sound promis inde first half soror boy appal ani comedi ever spill projector len	0.5
1999	81256.0	4189	biggi tupac undeni subvers involv in bold present	2.5
2000	92092.0	4793	lack zest goe plot twist instead trust materi	1.0
2001	73431.0	3753	refresh see movi embrac oldfashion theme in process come out look like someth wholli origin	3.6666666666666665
2002	35184.0	1654	ha marshal in servic minut idea	1.0
2003	101914.0	5365	argento onli 26 bring youth outtochangetheworld aggress project cut open vein bled raw film stock	3.0
2004	23251.0	1054	lrb crystal de niro rrb manag squeez out good laugh not enough make thi silli con job sing	2.0
2005	38152.0	1814	saddl unwieldi cast charact angl payoff power revelatori	3.0
2006	74977.0	3845	whole talkinganim thing grisli	1.0
2007	71662.0	3657	someth unintent comic in film drumbeat authent given stale plot pornograph way film revel in swank apart cloth parti	1.3333333333333333
2008	91289.0	4750	ha hallmark movi design strictli children home video market insati absorb manner lame entertain long 3yearold find divert	1.0
2009	48442.0	2367	cmon	2.0
2010	38300.0	1823	thi 10th film in seri look feel tire	1.0
2011	141827.0	7694	worst screenplay callow best young artist thought consider fatherhood	2.0
2012	16478.0	709	make great impress writerdirector thi littl 18 million charmer may not cuttingedg indi filmmak ha huge heart	3.0
2013	23589.0	1070	waydowntown manag nail spiritcrush ennui denud urban live without give in	3.0
2014	25269.0	1155	thi slender plot feel especi thin stretch over nearli 80minut run time	1.0
2015	149453.0	8135	liveact cartoon fastmov cheer simplist 88 minut exagger action put togeth preteen boy in mind	3.0
2016	10393.0	437	film ha difficult time shake blair witch project realtim root	1.0
2017	45788.0	2226	human natur in short nt nearli funni think neither smart	1.0
2018	128874.0	6932	ong choos present ah na life slight weightless fairi tale whose unpleas detail seem melt away in face charact blankfac optim	2.0
2019	75850.0	3891	end sort love peopl onscreen even though could not stand	3.0
2020	140212.0	7609	fantasma boldli confid orchestr aesthet sexual impact deepli rightli disturb	3.0
2021	142473.0	7732	everi note	2.0
2022	29550.0	1369	person rather watch anim planet	0.0
2023	118929.0	6356	tediou chatter parrot rais oprah	0.0
2024	152948.0	8349	michel piccoli move perform thi film reason	3.0
2025	60906.0	3076	much like easili dismiss take upscal lifestyl nt much	0.0
2026	126775.0	6816	made realiz realli nt good cheesi bmovi play in theater sinc well sinc last week reign fire	1.0
2027	9906.0	415	kouyat elicit strong perform hi cast deliv power commentari govern lie no matter run	3.5
2028	76843.0	3952	far heaven dazzl conceptu feat work enthral drama	3.0
2029	25307.0	1157	merchantivori team continu systemat destroy everyth hold dear cinema onli begun split up even damag	1.0
2030	113556.0	6037	cast von sydow intacto luckiest stroke	2.5
2031	108220.0	5726	preciou new star war movi lumber wheezi drag	0.0
2032	101233.0	5322	not exactli worth buck expend full price date come out video well worth rental	2.0
2033	52230.0	2580	domin christin sylvi testud icili brilliant	3.0
2034	80458.0	4145	sm seem like strang rout true love mayb thi film lrb maker rrb credit believ exactli two peopl need find themselv	3.0
2035	147625.0	8034	delight surpris becaus despit backstag drama thi movi tell stori work charm move funni look profession	4.0
2036	14873.0	640	wrap up classic motherdaught struggl in recycl paper shini new bow audienc tell not new least look pretti	2.0
2037	136449.0	7378	cast raymond j barri assassin greatli enhanc qualiti neil burger impress fake documentari	3.0
2038	125476.0	6742	fail satisfactorili exploit gender polit genr thrill inher humor	1.0
2039	17852.0	775	squander topnotch foursom actor	1.0
2040	40102.0	1921	kinnear perform careerdefin revel	4.0
2041	51123.0	2516	turn ley fabl listless climb down social ladder	1.0
2042	110378.0	5846	overal tomfooleri like thi matter tast	1.0
2043	137490.0	7439	like vardalo corbett play role vibrant charm film direct joel zwick heartfelt hilari in way ca nt fake	4.0
2044	68414.0	3472	adroit final trifl flat mad love doe nt galvan outrag way say jane campion might done least possess	2.0
2045	42027.0	2023	want jolt out gourd drop everyth run ichi	3.0
2046	27459.0	1261	one allow churn out one mediocr movi anoth	1.0
2047	129153.0	6945	ani reason creativ eighthgrad could written credibl script though number continu error	0.0
2048	99502.0	5218	highli person look effect live dysfunct privileg lifestyl end onli wish could spent time in world	2.5
2049	41135.0	1972	hill look go motion begin pale script	1.0
2050	98677.0	5175	engag emot level funnier whole less detach	2.0
2051	63302.0	3203	thi movi trust	4.0
2052	16172.0	698	bard black comedi	2.0
2053	112134.0	5953	philosoph intellectu logist mess	0.0
2054	75075.0	3850	kilt jackson unsettl sight indic hi outofkilt charact rambl aimlessli illconceiv action piec	1.0
2055	17918.0	780	feel like 1920 trip great deal fun	3.0
2056	111111.0	5889	henri bean thought screenplay provid no easi answer offer compel investig faith versu intellect	3.0
2057	43020.0	2077	look smart nuanc look de sade might happen picpu sade film	3.0
2058	150825.0	8221	get imag big papa span histori rather suspend	2.0
2059	96980.0	5069	lack thesi make maryam in end play out intellectu emot impact afterschool special	2.0
2060	138799.0	7523	would nt nice guy got tast like side bra	2.0
2061	62137.0	3142	engross portrait uncompromis artist tri creat someth origin backdrop	3.0
2062	44977.0	2182	stifl moral tale dress up in peekaboo cloth	2.0
2063	5277.0	209	latest eccentr superwealthi megalomaniac bent world domin destruct	2.0
2064	30893.0	1438	like pack dynamit stick built controversi	1.0
2065	38220.0	1818	peopl make fun like showgirl	1.0
2066	4970.0	194	movi gener plot point degre random usual achiev onli lotteri draw	1.0
2067	38914.0	1856	men in black ii achiev ultim insignific scifi comedi spectacl whifflebal epic	0.0
2068	141995.0	7702	wellmad mushheart	3.0
2069	154550.0	8448	bondinspir	2.0
2070	85129.0	4403	undeni gorgeou termin smitten document troubadour hi acolyt triumph hi band	3.0
2071	86884.0	4503	yo day live meet electr boogaloo	2.0
2072	125906.0	6763	leaden predict	0.5
2073	115858.0	6175	script judgment sens weight way way	0.0
2074	118434.0	6328	rare film whose reallif basi in fact interest no embellish need	3.0
2075	28282.0	1303	give margin thumb up	3.0
2076	108030.0	5716	think everi possibl angl ha exhaust documentarian anoth new film emerg yet anoth remark yet shockingli littleknown perspect	3.0
2077	60648.0	3063	77 minut pokemon may not last 4ever seem like doe	1.0
2078	36132.0	1707	home alon film stage like rosemari babi not wellconceiv either film	1.0
2079	57477.0	2900	sometim feel film careen one color event anoth without respit	1.6666666666666667
2080	120575.0	6448	gentl comic treatment adolesc sturm und drang pleas fan chri fuhrman posthum publish cult novel	3.0
2081	31182.0	1456	deliv terrif perform in thi fascin portrait modern lothario	3.0
2082	110449.0	5851	may drug dealer kidnap unsavori folk tone pace shockingli intim	2.5
2083	150551.0	8204	mildli entertain especi find comfort in familiar	2.5
2084	12761.0	550	small gem movi defi classif thoughtprovok funni scari sad	3.0
2085	56235.0	2819	fullfront attack audienc patienc	1.0
2086	31952.0	1496	too intens focus travail hal hartley function pastich no thing hartley least access screed yet	1.0
2087	132908.0	7167	dabbl around never gain much momentum	1.0
2088	113917.0	6056	allen show outgag ani young whippersnapp make move pictur today	3.0
2089	93803.0	4893	meld deriv element someth often quit rich excit alway beauti behold	3.5
2090	6701.0	268	uplift larg bogu stori	2.5
2091	112697.0	5984	almost offens freddi got finger	1.0
2092	46950.0	2288	not wallow in charact frustrat movi busi contriv fals sitcomworthi solut problem	1.0
2093	9709.0	404	despit slick product valu director roger michel ticktock pace	2.0
2094	69683.0	3545	openend compos layer upon layer talk cinephil feast invit countless interpret	2.0
2095	67029.0	3403	onc one experi mr hanek sadist tendenc toward hi audienc one left sour tast in one mouth littl els	0.0
2096	40221.0	1927	gloriou dose humankind liber abil	3.0
2097	93713.0	4887	simpl poignant leaven humor film affirm nourish aspect love companionship	3.0
2098	137202.0	7420	sweet treasur someth well worth	4.0
2099	95654.0	4997	even push agenda too forc thi remain film someth one attempt often achiev level connect concern	3.0
2100	49654.0	2434	ha made film intox atmospher littl els	1.5
2101	134152.0	7240	porn brian de palma	2.0
2102	126582.0	6806	seem base ugli idea instead ugli behavior happi wa henc storytel far appeal	4.0
2103	19128.0	839	definit crowdpleas wa roman colosseum	3.0
2104	108282.0	5730	laughabl rather unlaugh excus film	0.0
2105	4130.0	156	film not onli love song movi also fulli exampl kind lush allenvelop movi experi rhapsod	4.0
2106	100558.0	5277	befor collaps exactli kind buddi cop comedi set out lampoon anyway	1.0
2107	78771.0	4054	like endur long workout without puls ever race	2.0
2108	36622.0	1734	thi gentl mesmer portrait	3.0
2109	149166.0	8116	move even corniest hackney contriv	2.0
2110	33765.0	1588	ha 34th fun spri 2001 predecessor rush slapdash sequelforthesak ofasequel less half plot ingenu	0.0
2111	86102.0	4457	myer ha turn hi franchis movi version adolesc dirtyjok book done up in posttarantino popcultur riff	2.0
2112	69363.0	3526	feel charact stage life	2.0
2113	36015.0	1700	ye suppos love cal work out hi issu hi dad come term hi pictureperfect life world travel gave no reason care nt	0.0
2114	97373.0	5093	canada arctic light shine bright thi frozen tundra soap opera breath extraordinari life privat exist inuit peopl	3.0
2115	16962.0	736	send cranki	2.0
2116	153252.0	8370	not one moment in enterpris nt make want lie down in dark room someth cool brow	2.0
2117	145106.0	7883	admir sometim except film	4.0
2118	122896.0	6593	stay credit see devast comic imperson dustin hoffman revelatori	3.5
2119	153825.0	8402	good documentari make interest subject thought would leav cold	3.0
2120	81371.0	4194	movi certainli ha share clever moment bite dialogu not much lurk abstract surfac	2.0
2121	103930.0	5481	mustse fan thought war film interest in sight sound battl	4.0
2122	22334.0	1006	runofthemil raunchi humor seemingli sincer person reflect	2.0
2123	33725.0	1586	memor experi like mani hi work present weighti issu color wrap up in hi idiosyncrat strain kitschi goodwil	3.0
2124	154347.0	8436	romanek keep ad flourish artsi fantasi sequenc simpli feel wrong	1.0
2125	125944.0	6766	like titl charact esther kahn unusu unfortun also irrit	1.0
2126	112844.0	5992	no affin charact	0.75
2127	47968.0	2340	72yearold robert evan slow down stroke ha least one stori tell hi	3.0
2128	112676.0	5983	like new yorker realli human in week 911	3.0
2129	118629.0	6340	bright invent thoroughli win flight revisionist fanci	3.0
2130	116788.0	6229	live testament power eccentr strang	3.0
2131	132946.0	7170	farflung	1.0
2132	56345.0	2825	thi film live far too much in head	1.0
2133	136902.0	7405	up decid whether admir peopl dedic caus repel dogmat manipul narrow fear view american life	1.5
2134	67994.0	3451	might biggest husbandandwif disast sinc john	1.0
2135	28079.0	1290	ahnuld action hero day might over	1.0
2136	73934.0	3781	gay straight kiss jessica stein one greatest date movi in year	4.0
2137	138919.0	7529	enjoy random veri live dream	3.0
2138	54377.0	2702	potboil absurd contriv overblown entir implaus final	0.0
2139	80444.0	4144	wonder anyon saw in thi film allow get made	0.0
2140	27157.0	1250	near end take whole mean	2.0
2141	84330.0	4358	color energet sweetli whimsic rare sequel better predecessor	4.0
2142	79706.0	4104	best stun star turn djeinaba diop gai	4.0
2143	33527.0	1573	vividli demonstr director hollywood blockbust patriot game still turn out small person film emot wallop	4.0
2144	60588.0	3059	stori simpli putter along look astut observ come up blank	1.0
2145	76589.0	3939	may take sweet time get wherev go patienc wo nt feel like wast	3.0
2146	122757.0	6586	highli amus idea come point in societi ha deem import enough make film in someon ha hire portray richard dawson	2.333333333333333
2147	10658.0	452	even 50million us budget pinocchio never quit achiev feel fanci motion pictur	1.0
2148	17703.0	766	quiet disquiet triumph	3.0
2149	147274.0	8014	must fan british cinema onli becaus mani titan industri along ride	3.333333333333333
2150	27943.0	1283	ebulli tunisian film startl transform traditionbound widow drawn exot world belli danc	3.5
2151	49758.0	2441	lilo stitch nt edgi piec disney anim hit silver screen thi first film use watercolor background sinc dumbo certainli rank origin in year	4.0
2152	100642.0	5284	got pretenti eyerol moment nt entir grab stuff like	2.0
2153	29405.0	1363	might accept print page ile book doe not translat well screen	0.0
2154	146639.0	7977	feel anyth much watch thi movi beyond mild disturb detach pleasur act	1.0
2155	49071.0	2397	dolman confin shtick sentiment one bald sloppi	2.0
2156	7648.0	310	judith zaza extend bedroom sequenc intim sensual funni psycholog selfrev make pass sex in movi look like cheap hyster	4.0
2157	119774.0	6406	often shock ultim worthwhil explor motherhood desper mother	4.0
2158	123982.0	6656	graini rough depend naturalist rather care lit set up exhaust watch	1.0
2159	108996.0	5771	sink usual cafeteria goulash fart joke masturb joke racist japanes joke	1.5
2160	27827.0	1278	onc downward spiral come pass auto focu bear out typic junki opera	1.0
2161	29466.0	1365	ye like old friend dinner	3.0
2162	25064.0	1145	choke selfconsci	1.0
2163	73536.0	3759	wo nt exactli know happen bliss exhaust	2.333333333333333
2164	65223.0	3301	bibbidybobbidibland	0.0
2165	85509.0	4422	angel present event partli perspect aureli christel infus film sensibl particularli nightmarish fairytal	3.0
2166	79205.0	4079	ozpetek avoid pitfal expect in potenti sudsi setup	3.0
2167	55797.0	2791	grace move tribut courag new york finest nice underst express grief	4.0
2168	56574.0	2841	lightest breezi movi steven spielberg ha made in decad	3.0
2169	77180.0	3970	glimps natur famili warmth time out discreet moan despair entrap in maze modern life	2.0
2170	34152.0	1604	rel noth happen	0.0
2171	77942.0	4011	action reason welldon yet stori charact comedi bit too rag ever fit smoothli togeth	2.0
2172	57881.0	2917	live gay men	2.0
2173	131897.0	7111	draw irresist languid romantic byler reveal way in sultri even beerfuel afternoon in sun inspir even retir heart ventur forth	4.0
2174	71194.0	3633	vehicl savour binoch skill film well worthwhil	4.0
2175	23910.0	1086	parabl love charact commun someth rather beauti human natur	3.0
2176	103110.0	5437	sex psycholog drug philosophi	2.0
2177	45763.0	2225	tuxedo wa nt bad wa friend david cross would call hungryman portion bad	1.0
2178	19544.0	858	charm funni moment not quit enough	2.0
2179	126193.0	6781	stale overus cocktail use oliv sinc 1962 garnish	1.0
2180	132749.0	7158	nt wait see thi terrif film kid nt kid borrow	3.0
2181	54877.0	2734	filmmak dana janklowiczmann amir mann area head east far east in retel histor signific person episod detail one intern citi welcom ten thousand german jewish refuge world democraci	3.0
2182	71898.0	3670	bit cold rel flavorless	1.0
2183	3994.0	151	spielberg realiz nearfutur america master	4.0
2184	83178.0	4294	fourth in seri bet parent thought	2.0
2185	113833.0	6050	ai nt none problem	2.0
2186	113394.0	6025	film boast dri humor jar shock plu moment breathtak mysteri	4.0
2187	88117.0	4577	surpris thing thi film actual releas theater	0.0
2188	111461.0	5913	in hi latest effort storytel solondz ha final made movi nt offens also happen good	3.0
2189	27411.0	1259	vividli recal cari grant room one houseboat father goos in affection depict gentl war reluct irrespons man kid latch onto	3.0
2190	104418.0	5510	never escap heart boy right movi come along especi begin name star war	3.0
2191	103589.0	5464	sight name bruce willi bring mind imag violent battlefield action pictur film ha lot mind mayb too much	2.0
2192	43397.0	2099	fact best part movi come 60second homag one demm good film doe nt bode well rest	1.0
2193	118116.0	6309	depress reward	3.0
2194	140311.0	7615	wit hoopla festiv in cann offer rare insight structur relationship	3.0
2195	40562.0	1942	in engag audienc in travail creat screenplay	3.0
2196	57254.0	2885	start intens polit psycholog thriller sabotag tick time bomb hollywoodact clich	0.0
2197	14211.0	613	walk out good girl mix emot disapprov justin combin ting understand action	2.0
2198	125578.0	6746	doe nt mean still wo nt feel like longest 90 minut moviego life	1.5
