	PhraseId	SentenceId	Phrase	Sentiment
4031	155177.0	8496	moor like progress bull in china shop provocateur crash idea specialinterest group slap togeth hi brand liber	1.0
4032	83777.0	4331	queen men throwback war movi fail mani level pay repar viewer	0.0
4033	128822.0	6930	director kevin bray excel in break glass mark miami vice checklist power boat latin music dog track	2.0
4034	79060.0	4069	compel stori music passion government odd	4.0
4035	663.0	24	occur 7 time dure windtalk good indic seriousmind film	3.0
4036	129974.0	6998	magic lrb origin run time rrb ace japanim hayao miyazaki spirit away	3.0
4037	124374.0	6681	bravo histori rewritten uncompromis knowledg highest power power love	3.0
4038	143186.0	7773	bittersweet film simpl in form rich human event	4.0
4039	151811.0	8284	plod along minu twist humor eyepop visual made miik cult hero	2.0
4040	91580.0	4766	shyamalan offer copiou hint along way myriad sign beneath familiar funni surfac far bigger far meaning stori one in littl green men come earth harvest purpos	3.0
4041	31229.0	1459	gener much chemistri iraqi factori pois receiv un inspector	1.0
4042	20985.0	938	whole affair predict	2.0
4043	121380.0	6502	mike white deft combin seriou subject matter dark funni humor make good girl film worth watch	4.0
4044	89793.0	4673	like unbalanc mixtur graphic combat footag almost saccharin domest interlud pure hollywood	1.0
4045	70585.0	3598	know make imagin	3.0
4046	112531.0	5977	freshfac bigheart frequent funni thrill ride kiddi enough eye candi cheeki wit keep parent away concess stand	4.0
4047	98196.0	5145	ugli pointless stupid	0.0
4048	134468.0	7254	graphic carnag recreat wartorn croatia	2.0
4049	116324.0	6202	anoth entertain romp robert rodriguez	3.0
4050	14585.0	629	although subject matter may still too close recent nation event film work mostli due superior cast charact	3.0
4051	3417.0	128	keenli observ refreshingli natur swim get detail right promenad bare clad bodi in myrtl beach sc adrenalin jolt sudden lunch rush diner	3.0
4052	9787.0	407	ambiti seriou film manag virtual everyth wrong	1.0
4053	112163.0	5956	bare manag few second over seemingli etern run time piqu interest imagin empathi anyth realli save disgust indiffer	1.0
4054	92880.0	4838	predominantli amateur cast pain watch stilt unconvinc perform	0.0
4055	74361.0	3810	charact never chang	1.0
4056	144462.0	7844	lrb take care cat rrb honestli nice littl film take us examin young adult life in urban south korea heart mind five princip	3.0
4057	42430.0	2045	special kind movi thi melanchol film noir remind lot memento	4.0
4058	100457.0	5270	unlik animaton japan charact move grace panach	3.0
4059	122840.0	6590	film headi yet far impenetr theori suggest russian take comfort in closedoff nationalist realiti	2.0
4060	38116.0	1813	like shrek spirit visual imagin remind whi anim perfect medium children becaus way allow mind enter accept anoth world	4.0
4061	118709.0	6345	scherfig writerdirector ha made film unabashedli hope actual make heart soar	4.0
4062	61486.0	3109	like egoyan work ararat fierc intellig uncommonli ambiti	3.0
4063	69136.0	3513	may not real laugh	4.0
4064	144776.0	7859	hole in stori somewhat predict plot	1.0
4065	122121.0	6545	expect get assum bar expect ha nt rais abov sixthgrad height	0.0
4066	70887.0	3614	not complet loveabl underdog movi sinc bad news bear ha	1.0
4067	26709.0	1225	social polit potenti state properti doe nt end up veri inspir insight	1.0
4068	45197.0	2196	thi first film ever seen no obviou direct involv	2.0
4069	93734.0	4888	good case fail provid reason us care beyond veri basic dictum human decenc	1.0
4070	135236.0	7302	ani redeem valu whatsoev	1.0
4071	21463.0	961	demm final succe in diminish hi statur oscarwin master lowli studio hack	1.0
4072	74377.0	3811	yet thi grate showcas almost make wish gone way simpson	2.0
4073	89842.0	4676	reco fantast perform doe nt exactli reveal make vincent tick perhap ani definit explan would felt like cheat	2.0
4074	90490.0	4710	hardi group determin new zealand ha prove creativ mettl	4.0
4075	96777.0	5055	knockaround guy play like student film two guy desper want quentin tarantino grow up	1.0
4076	79607.0	4098	disjoint parodi	1.0
4077	101780.0	5358	instead balanc film explain zeitgeist x game get cinemat postcard superfici unreal	0.0
4078	46060.0	2240	man elysian field doom small also elev kind movi enjoy becaus one lucki few sought out	3.0
4079	91179.0	4743	vie pretens sometim plain wacki implaus	1.0
4080	140510.0	7625	auto focu work unusu biopic document male swinger in playboy era	3.0
4081	149814.0	8157	exhilar blatantli bias	3.0
4082	101625.0	5348	misguid comedi	1.0
4083	119508.0	6389	perfectli portray desper veri insecur man	3.0
4084	124460.0	6687	absolut inescap gorgeou skyscrapertrapez motion amaz spiderman	4.0
4085	35947.0	1697	raunchi frequent hilari followup gift korean american standup one want	3.0
4086	5768.0	229	jolt charleston rhythm stori ha sizzl old news ha final found right vent lrb accur	2.0
4087	69144.0	3514	put primit murder insid hightech space station unleash pandora box special effect run gamut cheesi cheesier cheesiest	1.0
4088	25884.0	1186	lrb kirshner win close rrb	2.0
4089	89581.0	4659	hand down movi god silver platter	4.0
4090	97890.0	5126	doc nt tri simpli outshock outoutrag outdepress potenti audienc	2.0
4091	100594.0	5280	ultim movi too headi children too preachi adult	1.0
4092	141323.0	7665	deliv nearli enough show trademark	2.0
4093	100395.0	5268	nair cast larg altmanesqu deftli spin multipl stori in vibrant intox fashion	3.0
4094	146335.0	7958	hollywood end not showstoppingli hilari scathingli witti nonetheless	3.0
4095	68917.0	3501	in end weight water come resembl kind softcor twaddl expect see showtim red shoe diari	1.0
4096	59558.0	3004	sour santa claus 2 wa santa bump up 21st centuri realiti hard	2.0
4097	120620.0	6450	roger mouth never stop shut war sex win battl	3.0
4098	136386.0	7374	surprisingli charm even witti match best hollywood comicbook adapt	3.0
4099	153709.0	8395	in flounder way get	3.0
4100	20708.0	924	point often tender examin pro con uncondit	3.0
4101	123249.0	6616	work becaus flabbergast princip 14yearold robert macnaughton 6yearold drew barrymor 10yearold henri thoma convinc us exist wise wizen visitor faraway planet	2.0
4102	59148.0	2984	thi scarlet	2.0
4103	107837.0	5703	canadian filmmak gari burn invent mordantli humor take soulless work in citi	4.0
4104	149136.0	8115	move weighti depict one famili attempt heal death child	3.0
4105	29646.0	1374	filmmak tri balanc point often incis satir unabash sweet result sometim brace sometim baffl quit often in unexpect way touch	3.0
4106	106557.0	5627	unfortun also not veri good	0.0
4107	102662.0	5407	essenc great one	3.0
4108	9982.0	419	attal push too hard make thi comedi seriou drama	0.0
4109	20939.0	935	road pave good intent lead video store	3.0
4110	52848.0	2620	fairytal formula serv paper skeleton veri good act dialogu comedi direct especi charm	4.0
4111	21458.0	960	punit affirm parabl	2.0
4112	123003.0	6602	piec mildli entertain inoffens fluff drift aimlessli 90 minut befor lodg in crack evergrow categori unembarrass unmemor	3.0
4113	76919.0	3955	sweet home alabama certainli wo nt rememb one lrb witherspoon rrb better film	1.0
4114	90262.0	4698	alon worth price admiss	4.0
4115	85160.0	4405	over 25 iq over 90 driver licens abl find better entertain	0.0
4116	116180.0	6192	though jackson doe nt alway succeed in integr charact in foreground extraordinarili rich landscap must said imagin filmmak see forest tree	3.0
4117	32034.0	1500	genuin funni ensembl comedi also ask audienc in heartwarm nonjudgment kind way consid valu in daili live	4.0
4118	146435.0	7966	movi made big screen small screen like ballist eck vs sever made palm screen	1.0
4119	152538.0	8323	pour le	2.0
4120	116891.0	6237	rapidli develop gutwrench examin way cultur differ emot expect collid	3.0
4121	137215.0	7422	movi brilliant realli	4.0
4122	52375.0	2590	choppi overlong documentari lifestyl	1.0
4123	138732.0	7518	fill alexandr desplat haunt sublim music movi complet transfix audienc	4.0
4124	129276.0	6952	juxtaposit overwrought existenti stomachchurn gore forev verg either crack up throw up	2.0
4125	129023.0	6939	even in sorrow find humor	3.0
4126	121682.0	6521	though equal solipsist in tone movi ha enough vital justifi notion creat screen adapt evan saga hollywood excess	3.0
4127	44287.0	2148	movi jolt out seat coupl time give few laugh leav feel like wa worth seven buck even though doe turn out bit cheat in end	3.0
4128	54150.0	2690	inform intrigu observ often touch give human face often discuss in pure abstract term	4.0
4129	47994.0	2341	busi excit frantic involv chaotic entertain	1.0
4130	49860.0	2446	miss in murder number ani real psycholog ground teen deviant behaviour	0.0
4131	75459.0	3869	seemingli vehicl showcas canadian inan rambl steal harvard smorgasbord soliloqui noth deliv former mr drew barrymor	0.0
4132	32254.0	1512	jackson alway watchabl	3.0
4133	92894.0	4839	hmmm might suggest wayward wooden one end stuf electr pencil sharpen	1.0
4134	107013.0	5651	walter hill undisput like 1940 warner bros	3.0
4135	74139.0	3796	live mood rather savour stori	2.0
4136	89499.0	4654	warn too may feel time ha decid stand still	2.0
4137	90392.0	4704	hide behind cutesi film refer	1.0
4138	62652.0	3169	sluggish tonal uneven	0.5
4139	24860.0	1134	ultim too repel fulli endear american art hous audienc notabl stylist auster forc	1.0
4140	137322.0	7431	although no pastri violat thi nasti comedi poke fun easi target rowdi raunchfest fart boob unmention without much success	1.0
4141	120843.0	6467	though opera take place mostli indoor jacquot seem unsur evok ani sort natur set	2.0
4142	121223.0	6491	hi seri spectacular belli flop screen	1.0
4143	109670.0	5811	less fresh	1.0
4144	152075.0	8297	delici quirki movi	4.0
4145	141228.0	7661	want macdowel charact retriev husband ask whether person odyssey trump carnag claim mani live around	2.0
4146	106649.0	5632	like veri goofi museum exhibit	1.0
4147	82637.0	4267	thi make minor report necessari view scifi fan film ha best special effect ever	4.0
4148	104441.0	5512	asid rohmer bold choic regard point view ladi duke repres filmmak lifelong concern formalist experiment in cinemat art	3.0
4149	91900.0	4782	hot chick latest gimmick thi unimagin comedian	1.0
4150	130295.0	7019	whether jason x thi bad purpos never clear	0.0
4151	58744.0	2962	weight water come twoway timeswitch myopic mysteri stall in lacklust gear emot bland	1.0
4152	92040.0	4790	movi ca nt get suffici distanc leroy	1.0
4153	32062.0	1501	kirshner monro seem in contest see outbadact	0.0
4154	51273.0	2524	thi scifi technosex thriller start out bizarr keep get weirder	2.0
4155	112706.0	5985	plot grow thin soon find pray quick resolut	1.0
4156	30741.0	1430	too much exploit too littl art	1.0
4157	28124.0	1292	sweetest thing leav bitter tast	0.0
4158	110682.0	5865	baffl subplot involv smuggl drug insid danish cow fall flat go alter bard end better good altern	1.0
4159	108142.0	5721	death smoochi tell moldyoldi notnearli asnasti asit thinksiti joke	1.0
4160	56026.0	2802	surprisingli consid baird former film editor movi rather choppi	1.0
4161	116225.0	6194	thi film manag find great in hue drastic iconographi	3.0
4162	27678.0	1271	clever unflinch in comic barb slap small reward comedi take aim contemporari southern adolesc never let up	4.0
4163	104095.0	5489	kuri never show whi period volatil romant live sand musset worth particular attent	2.0
4164	26490.0	1215	oh look clever angl	3.0
4165	11621.0	502	film ha throwntogeth feel summercamp talent show hastili written underrehears arbitrarili plot fill crude humor vulgar innuendo	1.0
4166	105238.0	5557	elev movi abov runofthemil singl blender surreal sens humor technolog finish	4.0
4167	103816.0	5473	splendidli illustr abil human spirit overcom advers	3.0
4168	13654.0	586	no mean great movi refreshingli forthright one	3.0
4169	40728.0	1952	nt convinc calvin jr barbershop repres sort beacon hope in middl chicago south side	1.0
4170	5597.0	223	play like bad blend overrip episod tv dawson creek recycl dumbeddown version love stori	0.0
4171	90088.0	4689	thi fine written superbl act offbeat thriller	4.0
4172	24321.0	1106	instead see chanc revit alway ha remark clungto tradit	3.0
4173	77690.0	3995	exuberantli romant seren melancholi time	3.0
4174	87244.0	4525	in pianist polanski say ha long want say confront root hi preoccup obsess allow noth get in way	3.0
4175	1938.0	72	lrb scherfig rrb ha made movi leav wonder charact live clever credit roll	3.0
4176	114982.0	6124	byler too savvi filmmak let thi morph typic romant triangl	3.0
4177	48782.0	2382	sure hate in morn	1.0
4178	100517.0	5273	mawkish dialogu	1.0
4179	144432.0	7843	broad cartoonish screenplay accuraci observ in work director frank novak keep film ground in undeni social realism	3.0
4180	59582.0	3005	linger long irrelev engag gradual turn time	2.0
4181	78150.0	4022	warm wise deftli set uproari humor underli serious sneak up viewer provid experi richer anticip	4.0
4182	65514.0	3318	ringu disast stori full hole complet lack in chill	0.0
4183	8683.0	361	turn occasion fortifi thi turgid fabl	2.0
4184	83494.0	4314	movi competit	2.0
4185	52689.0	2609	minor film major pleasur portugues master manoel de oliviera	4.0
4186	142558.0	7740	come learn mani time finger count jason killer doe nt know mean word quit	2.0
4187	38440.0	1831	benefit sharper cleaner script	3.0
4188	48405.0	2364	outsid burger desir make kind film realli unclear whi thi project wa undertaken	1.0
4189	103194.0	5443	kid stay in pictur great stori terrif told man wrote thi cliff note edit cheat	3.0
4190	138822.0	7524	tri ether end up seem goofi	1.0
4191	21974.0	985	filmmak could dredg up	1.0
4192	130131.0	7008	better suit histori biographi channel no argu tone movi leav bad tast in mouth question mind	1.0
4193	145275.0	7894	too bad kramer could nt make guest appear liven thing up	1.0
4194	8191.0	339	rock standup magic wane	1.0
4195	128289.0	6902	simpl innoc movi imagin	3.0
4196	100419.0	5269	touch smartli wist number theme not least notion margin member societi	2.0
4197	41480.0	1995	empti purposeless exercis	0.0
4198	114673.0	6102	come brave uninhibit perform lead actor	4.0
4199	55610.0	2777	particularli joyless exceedingli dull period comingofag tale	0.0
4200	134138.0	7239	lrb sam rrb selfflagel depress entertain	0.0
4201	115081.0	6131	coppola directori debut incred layer stylist film despit fairli slow pace almost humdrum approach charact develop still manag least decent attempt meaning cinema	3.0
4202	3863.0	147	madonna give best perform sinc abel ferrara beaten pulp in hi danger game	3.0
4203	61800.0	3124	pictur seem uncertain whether want acid allmal eve lush swoon melodrama in intermezzo strain	1.0
4204	77814.0	4002	strang occurr build in mind viewer take extrem urgenc	3.0
4205	22506.0	1018	lrb rrb wonder loopi tale love long vote	3.0
4206	19741.0	870	god bless crudup hi avers take easi hollywood road cash in hi moviestar	3.0
4207	31887.0	1493	quickli lose focu point purpos in mess mix messag overblown drama bruce willi scar	0.0
4208	19926.0	884	ha never made sheerli beauti film thi unexpectedli move medit love histori memori resist artist transcend	4.0
4209	115881.0	6177	shamelessli resort peerel sight gag might even caus tom green grimac still myer energi silli eventu prevail	2.0
4210	5798.0	231	william play sy anoth hi openfac smile madmen like killer in insomnia	2.0
4211	148633.0	8087	compar usual somber festiv entri davi highli person brand romant comedi tart smart breath fresh air stand out pack even pictur somewhat problemat	4.0
4212	82816.0	4277	paraphras line anoth dicken novel nichola nicklebi too much like fragment underdon potato	0.0
4213	78232.0	4025	offer absolut noth nt alreadi seen	1.0
4214	99982.0	5247	complex polit charg tapestri contemporari chines life thi excit new filmmak ha brought screen like noth western seen befor	3.0
4215	87047.0	4513	deflat end asid much recommend film	3.0
4216	52010.0	2565	masterpiec challeng one	4.0
4217	42183.0	2031	punch line without premis joke built entir musti memori halfdimension charact	2.0
4218	77646.0	3993	leather pant augment boob hawn hilari tri resuscit funlov libertin lost somewher insid conserv handbagclutch sarandon	3.0
4219	148243.0	8068	anyth see karen black camp up storm fring feminist conspiraci theorist name dirti dick	3.0
4220	26332.0	1206	cast spot mood laid back	3.0
4221	110534.0	5858	case convinc one give anyon conscienc reason paus	4.0
4222	46972.0	2289	fan critic darl band wilco marvel sometim murki alway brood look tri break heart	3.0
4223	83950.0	4338	dian lane sophist perform ca nt rescu adrian lyne unfaith sleazi moral	1.0
4224	102822.0	5419	children occupi 72 minut	3.0
4225	6475.0	257	admit onli complaint nt get recreat famou moment show	3.0
4226	108467.0	5740	comingofag tale new zealand whose boozi languid air balanc rich visual clariti deepli	3.0
4227	78264.0	4027	perform children untrain in act	1.0
4228	49343.0	2414	engross stori combin psycholog drama sociolog reflect highoctan thriller	4.0
4229	96403.0	5036	parker updat set in attempt make film relev today without fulli understand wa made stori relev in first place	1.0
4230	105685.0	5579	lee seem expect ador widesmil recept	3.0
4231	84883.0	4390	jackson tri keep plate spin best bounc back forth ca nt help becom bit tediou even breathtak landscap villain varmint distract ricochet	1.5
4232	41276.0	1981	muddl repetit rag say far less horrifi histor realiti filmmak characterist style	0.0
4233	118544.0	6334	unexpect thing die in thi shower blackandwhit psychedelia quit beauti	3.0
4234	83466.0	4312	kneejerk misogyni pass humor in mani teenag comedi	1.0
4235	41459.0	1993	someth like nostalgia	2.0
4236	135638.0	7327	brain littl scatter ditsi even	1.0
4237	43647.0	2115	beauti produc	4.0
4238	78948.0	4062	moment real pleasur found in sara sugarman whimsic comedi veri anniemari not enough sustain film	2.0
4239	25374.0	1160	cockey shot way	1.0
4240	8368.0	348	saw thi movi well probabl not accur call movi	1.0
4241	122422.0	6565	farc parodi comedi premis nt comparison realiti much commentari knowledg film	2.0
4242	85154.0	4404	attempt complic stori	1.5
4243	102591.0	5401	onli problem end no one in audienc film seem realli care	0.0
4244	57692.0	2908	work too hard thi movi	1.25
4245	101390.0	5330	go out limb	2.333333333333333
4246	33709.0	1583	trust stori set out tell	3.333333333333333
4247	118683.0	6344	hoot watch rock chomp jumbo ant pull arrow out hi back leap unscath rage fire	3.25
4248	136267.0	7367	entertain despit onejok premis thesi women venu men mar inde get togeth	2.5
4249	19229.0	844	natur funni film home movi make crave chri smith next movi	4.0
4250	63160.0	3193	cleti tout never becom clever crime comedi think	1.0
4251	136307.0	7369	sweet funni charm complet delight	4.0
4252	72905.0	3723	possess in end honor interest failur	2.0
4253	7147.0	291	got david lynch jone	2.0
4254	94505.0	4933	beauti reclaim stori carmen recreat in african idiom	3.0
4255	27639.0	1269	mariah carey give us anoth peek magic saw in glitter in wisegirl	3.0
4256	90969.0	4732	funni littl movi clever dialogu likeabl charact	4.0
4257	116571.0	6216	make worth trip theatr	3.2
4258	45142.0	2192	weak ineffect ghost stori without conclus pay	0.3333333333333333
4259	120718.0	6457	extraordinari dramat experi	4.0
4260	21642.0	969	pull rug out under readi hate one charact realli sympath anoth charact someth happen send in differ direct	2.0
4261	65381.0	3311	somber pace lack dramat firework make green dragon seem like medicin entertain	0.0
4262	106422.0	5621	murphi wilson actual make pretti good team project surround distressingli rote	1.5
4263	123683.0	6642	passabl enough shootout in ok court hous life type flick	2.0
4264	146474.0	7968	still not everi lowbudget movi must quirki bleak happi end no cinemat sin	2.0
4265	56265.0	2821	find root monster in horror movi know pictur in troubl	0.0
4266	77713.0	3997	someth ultim scorses film stomachturn violenc color new york gang lore hallmark hi person cinema paint largestev histor canva	4.0
4267	100992.0	5305	bring togeth biggest name in japanes anim impress result	3.5
4268	55303.0	2758	in thi film least see studi in contrast wide rang one actor limit rang comedian	2.0
4269	55622.0	2778	onc laughabl compuls watchabl in commit dumb	2.0
4270	153053.0	8357	good film must baffl folk in market depart	3.0
4271	134768.0	7275	hit everi clich come expect includ assumpt crazi peopl innoc childlik inher funni	0.6666666666666666
4272	151748.0	8280	lot problem	1.0
4273	26947.0	1237	promis georgianisra director dover kosashvili	2.5
4274	67769.0	3442	whenev think seen end movi cut new scene also appear end	1.0
4275	78104.0	4020	13 month 295 preview screen sinc last walk out movi resid evil realli earn indign preemptiv departur	0.5
4276	68785.0	3494	although god great address interest matter ident heritag hard shake feel wa intend differ kind film	1.0
4277	7711.0	312	soulsearch garbag	0.0
4278	152911.0	8347	rare lightli entertain look behind curtain separ comic peopl laugh in crowd	4.0
4279	96227.0	5027	no thing sort minimalist beauti beast in thi case beast definit get top bill	3.0
4280	68620.0	3484	enigma wellmad too dri too placid	1.5
4281	122534.0	6572	respons new sequel analyz	2.0
4282	36425.0	1723	know sens humor lot warmth	4.0
4283	102774.0	5416	lrb rrb espit familiar subject matter ice age consist amus engross	3.0
4284	146408.0	7963	manic gener christma	2.5
4285	12514.0	537	not ani us complain film clock in around 90 minut day plot leav lot desir	1.0
4286	111946.0	5942	explos essenti ruin rather overpow fiction movi	1.0
4287	32501.0	1523	pianist lrb rrb suprem hope cautionari tale war mad rememb today prevent tragic wast life	4.0
4288	53050.0	2631	rashomonfordipstick tale	0.0
4289	120497.0	6443	complet aw iranian drama much fun grouchi ayatollah in cold mosqu	0.0
4290	115700.0	6166	fabul funni over top veri sneaki butler excel in art imposs disappearingreappear act	3.5
4291	56868.0	2860	whi sex lucia allur	3.0
4292	50343.0	2476	tale too familiar anyon seen georg roy hill 1973 film sting	1.0
4293	148088.0	8060	without ha brace truth refresh phoni femalebond pictur like divin secret yaya sisterhood	3.5
4294	15959.0	685	said done love piec trust	3.0
4295	148323.0	8071	welldon film selfreflex philosoph natur	4.0
4296	75517.0	3872	doe nt need gang new york	2.0
4297	110850.0	5874	cox creat fluid mesmer sequenc imag match word nijinski diari	3.0
4298	138320.0	7487	need lesson in repugn	1.5
4299	69010.0	3506	premis ripe manner lunaci kaufman gondri rare seem sure go	1.0
4300	69111.0	3510	even better first one	3.0
4301	80851.0	4167	decidedli mix bag	2.0
4302	33685.0	1582	design reveri memori regret onli thing regret rememb experi sit	0.5
4303	90505.0	4711	brutal honest told humor poignanc make messag reson	4.0
4304	104555.0	5521	captiv comingofag stori may also first narr film truli inform wireless age	4.0
4305	36718.0	1739	woodi allen use ridicul movi like hollywood end	1.0
4306	128678.0	6921	not much movi joint promot nation basketbal associ teenag rap adolesc posterboy lil bow wow	0.0
4307	145917.0	7933	may not histori	2.0
4308	102274.0	5382	suffici funni amus even resolut unreligi parent escort littl one megaplex screen	3.0
4309	67652.0	3436	whether not enlighten ani derrida lectur self	2.0
4310	93147.0	4854	yaya mani secret one book better	0.5
4311	13089.0	563	green ruin everi singl scene in film not complet wreak serious compromis	1.0
4312	135925.0	7343	laugh aplenti bonu viewer nt worri subject fart urin fece semen ani foul substanc overrun modernday comedi	3.5
4313	51576.0	2542	charm lead perform allow us forget film problem	3.0
4314	91165.0	4742	might call exampl haphazard evil	2.0
4315	37851.0	1800	overal result intellig realist portray test boundari	4.0
4316	67706.0	3439	thi amiabl pictur talk tough bluster in end sweet greenfing	3.0
4317	3500.0	130	hew out world carri us effortlessli dark light	3.0
4318	108440.0	5738	hi groov	2.0
4319	113141.0	6010	deem necessari document thi emot miseri	0.0
4320	89516.0	4655	everybodi wanna watch movi in guy dress children parti clown get violent gangrap	0.0
4321	126046.0	6772	demm get lot flavor spice hi charad remak ca nt disguis spif up leftov nt substanti fresh	1.0
4322	89553.0	4657	courtney chase stuart cell phone	2.0
4323	56295.0	2822	characterdriven storytel	3.0
4324	114068.0	6065	certain cue like happi music suggest thi movi suppos warm heart jeonghyang lee film like blacken organ cold veng	2.0
4325	126134.0	6778	allegori concern chronic mix signal african american profession get overachiev could intrigu	2.6666666666666665
4326	100681.0	5288	rare window artist collabor	3.0
4327	54439.0	2706	short sweet also anyth els slight tadpol pull back consequ action revel	3.0
4328	132208.0	7128	dull somnambul exercis in pretens whose pervas quiet broken frequent outburst violenc nois	0.0
4329	108602.0	5748	even hi charact act horribl alway sympathet	2.5
4330	133023.0	7175	adult least dream imag west savor whenev film lamer instinct in saddl	1.5
4331	113654.0	6042	hard care film propos epic tragedi plight callow rich boy forc choos hi beauti selfsatisfi 22yearold girlfriend equal beauti selfsatisfi 18yearold mistress	1.0
4332	138434.0	7497	exhaust desicc talent ca nt get out hi way	2.0
4333	106077.0	5600	simpli unbear	0.0
4334	106657.0	5633	know ten buck spend ticket	1.6666666666666667
4335	125886.0	6762	stori need heard in sea holocaust movi	3.0
4336	9388.0	391	kathi lee gifford film director sadli prove onc ego doe nt alway go hand in hand talent	1.0
4337	123699.0	6643	highli spirit imagin kid movi broach neoaugustinian theolog god stuck in heaven becaus afraid hi bestknown creation	4.0
4338	106775.0	5640	miller tell thi veri compel tale littl fuss nois expertli pluck tension quiet	3.0
4339	98220.0	5147	delight without much stori	2.0
4340	30536.0	1419	wendigo want monster movi arthous crowd	1.6666666666666667
