	PhraseId	SentenceId	Phrase	Sentiment
6279	67683.0	3437	adam sandler heart may in right place need pull hi head out hi butt	1.0
6280	85299.0	4411	mandel holland direct uninspir hi script unsurpris	1.0
6281	80176.0	4131	not much work entertain uniqu wellcraft psycholog studi grief	3.0
6282	122039.0	6541	movi end swear wet in place feel sand creep in	2.5
6283	84968.0	4393	possibl documentari utterli entranc subject still show virtual no understand	1.0
6284	44616.0	2162	beauti entertain two hour	4.0
6285	43074.0	2080	far success consider less ambiti last year kubrickmeetsspielberg exercis	3.0
6286	124506.0	6690	allow hi cast member make creativ contribut stori dialogu	3.0
6287	61868.0	3128	too silli take serious	1.0
6288	29209.0	1352	small moment flashback nt add up much trite observ human condit	1.0
6289	127459.0	6856	lead natur love pace seren humor wri sprightli	4.0
6290	9416.0	392	much credit must given watercamera oper team king sonni miller michael stewart	3.0
6291	81391.0	4195	strang come kingdom mild wild	3.0
6292	89770.0	4672	despit quieter middl section involv aragorn dream arwen thi even better fellowship	3.0
6293	99945.0	5244	realli horribl drek	0.0
6294	17375.0	754	probe natur faith	2.0
6295	128213.0	6899	not quit shrek monster inc	2.0
6296	47708.0	2325	thi flat run hiphop tootsi poorli pace could fit pooti tang in punchlin	0.0
6297	86007.0	4450	consum sometim difficult tell actor in movi	2.0
6298	22786.0	1032	fascin come in power huston perform seem larger life yet fragil in way ivan charact accept news hi ill quickli still find unabl react	3.0
6299	64646.0	3272	moment hilar	3.0
6300	51799.0	2555	see whi peopl thought wa too hard mothman propheci	1.6
6301	124706.0	6702	wo nt hold up over long haul in moment finch tale provid forgett pleasur saturday matine	2.5
6302	79427.0	4091	litter trenchant satir jab peculiar egocentr act breed	1.0
6303	125101.0	6723	direct convincingli act	3.5
6304	90841.0	4727	rambl ensembl piec loos connect charact plot never quit gel	1.0
6305	154684.0	8459	compet direct termin cute drama	3.0
6306	143340.0	7781	spanieley jean reno infus hubert mixtur deadpan cool wri humor measur tender requir give thi comic slugfest heart	3.0
6307	97310.0	5088	wonder sober heartfelt drama	4.0
6308	15322.0	657	vivid portrait woman consum lust love crush betray conjur up intox fume emot ghost freshli paint rembrandt	4.0
6309	118825.0	6351	thriller send audienc out talk specif scari scene startl moment frailti leav us terrifi messag real horror may wait us home	2.5
6310	89201.0	4636	director capabl cast appear caught in headi whirl new ageinspir good intent	3.0
6311	79673.0	4102	plot ha number hole time simpli baffl	1.0
6312	126498.0	6802	salvo hit discern target	3.0
6313	151826.0	8285	lrb cockett rrb provid window subcultur hellbent express in everi way imagin	3.0
6314	19961.0	885	neither too erot veri thrill	1.5
6315	41335.0	1985	twohi good yarnspinn	2.6666666666666665
6316	146559.0	7972	tough funni rather chaotic show nt subvers much nitpicki hypocrisi time	2.5
6317	11082.0	473	hearten tale small victori endur hope	3.0
6318	81735.0	4217	movi ultim reli bit too heavili grandstand emot rockylik moment	1.3333333333333333
6319	38548.0	1838	trick watch godard catch pitch hi poetic savor pleasur hi sound imag ponder histor philosoph ethic issu intersect	3.0
6320	109816.0	5818	mani went see attract sole reason wa hot outsid wa air condit insid nt think ac help thi movi one bit	0.0
6321	71352.0	3639	lushli photograph beauti record	3.5
6322	19967.0	886	carri spoton scottish burr duval lrb also produc rrb peel layer thi charact may well not exist paper	3.0
6323	55116.0	2748	good perform keep total rehash	3.0
6324	130013.0	7001	end up move	2.6666666666666665
6325	30943.0	1442	in opinion analyz not funni entertain analyz thi	1.0
6326	152829.0	8341	kuri seem intimid subject matter period trap thi debut ventur heritag busi	1.0
6327	152809.0	8339	circuit awkwardli pace soap operaish stori	0.5
6328	91473.0	4759	stori virtual imposs follow	1.0
6329	102387.0	5388	feardotcom thrill cheap mostli work	2.0
6330	34826.0	1639	stylist romp alway fun watch	4.0
6331	145343.0	7898	movi hardli masterpiec doe mark ms bullock best work in time	3.0
6332	152984.0	8352	deliv tawdri kick	2.5
6333	33957.0	1595	requir view civic class wouldb public servant alik	3.0
6334	59615.0	3007	happi time maintain appeal veneer without becom too cute	3.0
6335	35664.0	1679	show sign potenti sequel not give us much thi time around	2.0
6336	111233.0	5898	ditch artsi pretens revel in entertain shallow	1.5
6337	101563.0	5342	delici nonsens comedi	3.0
6338	95999.0	5015	visual merit	2.6666666666666665
6339	20135.0	895	rather shapeless good time	2.5
6340	7841.0	319	one joke put toilet seat down	1.6666666666666667
6341	39381.0	1881	leer offer next littl insight intrigu subject	1.3333333333333333
6342	98201.0	5146	ritchi may not novel thought in hi head know pose madonna	2.0
6343	30319.0	1408	boarder venic beach wa deserv cowinn audienc award documentari sundanc film festiv	4.0
6344	117378.0	6263	everi movi come along remind us veri bad motion pictur truli	0.0
6345	87417.0	4534	exceedingli pleasant	4.0
6346	58529.0	2949	take fresh absorb look figur whose legaci begun bronz	4.0
6347	28524.0	1319	star help give spark chase ami chang lane fall flat think man cia agent jack ryan in thi summer new action film sum fear	1.5
6348	52018.0	2566	kind insult men women	0.75
6349	63517.0	3214	finest film	4.0
6350	17502.0	759	not schlocki creatur featur someth far stylish cerebr henc chillingli effect	3.0
6351	96833.0	5060	involv inspir drama sometim fall prey sobstori trap	2.0
6352	7401.0	301	no indic respons put togeth ani movi particular valu merit	1.5
6353	54302.0	2699	joke sophomor stereotyp sprinkl everywher	1.0
6354	364.0	14	fresnadillo ha someth seriou say way in extravag chanc distort perspect throw us path good sens	3.0
6355	143890.0	7809	slap saw thi movi	0.0
6356	66113.0	3354	journey span nearli three decad bittersweet camaraderi histori in feel truli know make holli marina tick heart go out continu negoti imperfect loveh relationship	3.0
6357	120105.0	6424	effect boost size downtown hotel take outer space	2.0
6358	81165.0	4182	hi showboat wisecrack stock persona sure get old	2.0
6359	23838.0	1083	1960 rebellion wa misdirect ca nt fight cultur	1.5
6360	30166.0	1400	everybodi love david goliath stori thi one told almost entir david point view	3.0
6361	95771.0	5003	no lie big fat liar real charmer	4.0
6362	95388.0	4981	scott convinc portray roger sad cad realli give film oomph	3.0
6363	73488.0	3756	silli loud goofi	2.5
6364	133989.0	7230	worthi gong	1.0
6365	100138.0	5254	movi like ghost ship use analges balm overstimul mind	1.5
6366	31299.0	1462	even hastili amateurishli drawn anim not engag	0.0
6367	20082.0	891	polit audaci film recent decad	3.0
6368	69677.0	3544	impecc studi in pervers	2.5
6369	147601.0	8032	not one decent perform cast not one clever line dialogu	0.3333333333333333
6370	43091.0	2081	plenti scene in frida work rare involv titl charact	2.333333333333333
6371	93864.0	4897	subject illus versu realiti nt realiti seem least passabl real	1.0
6372	131676.0	7097	mr hundert tell us in hi narrat thi stori without surpris nod in agreement	2.0
6373	113422.0	6027	salaci simplist	1.5
6374	63606.0	3220	movi like bartlebi someth stiff extradri offic comedi seem twice long 83 minut	1.0
6375	83067.0	4287	glimps hi life	2.0
6376	39315.0	1877	emot impress true hotblood lead up task	4.0
6377	129524.0	6965	real audiencepleas strike chord anyon ever wait in doctor offic emerg room hospit bed insur compani offic	3.0
6378	81898.0	4226	even crush depart 4w formula feel like glossi rehash	1.0
6379	14173.0	611	raw actionpack experi ringsid seat toughman contest	3.333333333333333
6380	45466.0	2210	never dull alway look good	3.5
6381	146412.0	7964	allen 66 ha stop challeng	1.0
6382	23682.0	1076	jagger stoppard director michael apt deliv rivet surprisingli romant ride	4.0
6383	140997.0	7648	pleasant engag enough sit in tri best world end up fall short whole	1.5
6384	8844.0	368	terrif date movi whatev orient	3.0
6385	146883.0	7992	move care happen in 1915 armenia	2.333333333333333
6386	131838.0	7107	proof thi	2.0
6387	56498.0	2838	polanski look back place saw childhood captur free artefact show heartbreakingli drabli	2.0
6388	108806.0	5760	quickli write corner	1.0
6389	117253.0	6256	work no level whatsoev	0.0
6390	88470.0	4598	though not veri well shot compos edit score too insist dialogu frequent overwrought crude liter	0.0
6391	82128.0	4238	match neoreal impact show human wartorn land	2.0
6392	87057.0	4514	call thi film lump coal would onli flatter	0.0
6393	132398.0	7139	hard conceiv anyon els in role	3.25
6394	127301.0	6847	charact gener plot bland even rogu cia assassin work chri cooper agenc boss close in resourc amnesiac nt feel much damonbourn hi predica	0.0
6395	84064.0	4343	fontain master creat portrait two strong men in conflict inextric entwin famili histori see in neither like see	3.0
6396	102446.0	5392	forget one oscar nomin juliann moor thi year get five	4.0
6397	2147.0	82	phillip noyc hi actor well hi cinematograph christoph doyl	2.0
6398	44721.0	2169	complet predict plot swear seen befor even never come within mile longest yard	0.0
6399	129685.0	6975	pure participatori event malnourish intellectu gulp down in frenzi	2.0
6400	132551.0	7147	unfortun work two star script	1.0
6401	1034.0	38	give new mean phrase fatal script error	1.0
6402	66945.0	3398	borstal boy nt especi realist engag nostalgia piec	2.0
6403	26977.0	1239	might like tri eat brussel sprout	1.0
6404	109056.0	5776	ingeni construct lrb adapt david hare michael cunningham novel rrb constantli flow forward back weav theme among three strand allow us view event prism	3.0
6405	132329.0	7135	serv sara littl mall movi design kill time	1.0
6406	7930.0	323	ignor clich concentr citi sea interperson drama	2.333333333333333
6407	62469.0	3160	too much nemesi ha tire talki feel	1.0
6408	72266.0	3694	fun wispi wise surprisingli inoffens film teen in love hi stepmom	3.333333333333333
6409	98559.0	5166	whether not buy mr broomfield find film acquir undeni entertain valu slight pale mr broomfield continu forc peopl situat would make lesser men run cover	3.0
6410	107261.0	5668	adapt intric construct in strang way nail orlean theme without true adapt book	3.0
6411	32630.0	1530	film doe nt enough innov pizazz attract teenag lack novel charm made spi kid surpris winner adult younger audienc	0.0
6412	33036.0	1548	simpli stupid irrelev deepli truli	1.0
6413	107717.0	5693	thi rich bittersweet isra documentari life songanddanceman pasach ke burstein hi famili transcend ethnic line	3.0
6414	39468.0	1885	lrb kid rrb too bratti sympathi film grow final hi littl chang ring hollow	0.5
6415	7799.0	317	except much much better	4.0
6416	60333.0	3047	novak contempl heartland overwhelm lack purpos seek excit in manufactur high drama	1.0
6417	100207.0	5258	intrigu polit 70 film everi bit fascin flaw	3.0
6418	47318.0	2307	could art heart necessari one	3.0
6419	100816.0	5296	holland let thing peter out midway notabl better act far less crass recent effort in burgeon genr film black urban profession	2.5
6420	122007.0	6540	make allur backdrop thi sensuou spirit tale prim widow find unlik releas in bellydanc club	2.5
6421	49901.0	2449	hypnot portrait thi sad compuls life	2.5
6422	86815.0	4498	austin power in goldmemb cinemat car wreck catastroph collis tasteless gall nevertheless leav fan clamor anoth ride	1.0
6423	24516.0	1116	labut master balanc tradit modern stori togeth in manner one never overwhelm	4.0
6424	69949.0	3559	thin line likabl oldfashion fuddyduddi count mont cristo never quit settl either side	2.0
6425	128029.0	6887	question hang over time machin not main charact suggest	2.0
6426	73385.0	3751	element condescens filmmak look down workingclass subject lofti perch final make sex stranger open today in new york metropolitan area distast	0.0
6427	51647.0	2546	though clearli wellintent thi crosscultur soap opera pain formula stilt	1.0
6428	151628.0	8271	jew cathol thi would catech	2.0
6429	34299.0	1611	huge entertain start finish featur fall grace still leav shockwav gratifi anyon ha ever suspect hollywood overrun corrupt hedonist weasel	4.0
6430	80911.0	4171	blade ii still topheavi blaze gun cheat film martial art disintegr bloodsuck comput effect jag camera move serv no purpos call attent themselv	0.5
6431	95028.0	4957	droll bitchi frolic poke fun price popular smalltown pretens in lone star state	1.0
6432	50630.0	2490	best didactic one carri strong sens human bertrand taverni oftbrilli safe conduct lrb laissezpass rrb wear heart sleev	4.0
6433	139786.0	7585	whole gonna like thi movi	3.0
6434	99219.0	5203	issu present in lousi way complet year lrb unintent rrb funniest moment imposs care	0.0
6435	147224.0	8010	godard still smarter ani 50 filmmak still work	4.0
6436	64609.0	3270	drama within drama unsolv murder unresolv moral conflict jockey spotlight	2.0
6437	109906.0	5822	wellact welldirect moodi not too pretenti	4.0
6438	64501.0	3265	whatev warn kid danger ouija board someon dispens advic film director	2.0
6439	134172.0	7242	imagin thi movi b w british comedi circa 1960 peter seller kenneth william et al thi time thi cast thi movi hopeless	0.5
6440	105257.0	5558	not quit comedi film tackl rel seriou subject open mind consider good cheer never less engag	2.0
6441	122967.0	6600	grownup quibbl besid point	2.0
6442	150816.0	8220	ha charisma young woman know hold screen	4.0
6443	13464.0	579	percept goodnatur movi	3.333333333333333
6444	139337.0	7555	film fearlessli get under skin peopl involv thi make not onli detail histor document engag move portrait subcultur	4.0
6445	16414.0	706	real winner smart funni subtl reson	4.0
6446	144978.0	7874	film like jimmi routin could use few good laugh	1.0
6447	14908.0	641	mayb feel 88minut ripoff rock action confin slomo gun fire random glassshatt	0.0
6448	154526.0	8447	shot in rich shadowi blackandwhit devil chronicl increasingli amus ironi relationship reluct captor befuddl captiv	4.0
6449	40119.0	1922	fool saw quentin tarantino hand raucou gangster film branch out pseudowitti copycat interpret	1.0
6450	82728.0	4273	movi ha gener virtu despit lot involv talent seem done number	2.0
6451	38827.0	1852	two hour sepiatint heavi metal imag surround sound effect peopl moan	2.0
6452	20237.0	901	disturb examin appear definit bad polic shoot	2.0
6453	72970.0	3727	perfect star vehicl grant allow final move away hi usual bumbl tongueti screen persona	3.5
6454	151551.0	8267	lost polit social observ becom anoth situat romanc coupl sap stuck in inarticul screenplay	1.0
6455	13701.0	590	rollick adventur matey regardless age	3.0
6456	21803.0	975	clever not especi compel	2.0
6457	78999.0	4065	spin web dazzl entertain may overst	3.333333333333333
6458	89423.0	4649	watch barbershop in need cube fix thi nt worth sit	0.5
6459	83122.0	4290	add enough flourish freakout make entertain	3.0
6460	40657.0	1947	poetic heartbreak	3.5
6461	129569.0	6967	sweatypalm fun	4.0
6462	27165.0	1251	script assum not onli would subtleti lost target audienc also too stupid realiz alreadi seen thi exact movi hundr time	0.0
6463	97350.0	5091	answer clear not easili in end not well enough	0.0
6464	25017.0	1141	much too convent lot bore talk head etc subject matter justic	1.0
6465	116282.0	6199	need littl less blingbl lot romanc	1.0
6466	121526.0	6510	anguish bitter truth	2.5
6467	149382.0	8129	mr soderbergh direct visual style struck unusu unimpress fussi pretenti	0.0
6468	96748.0	5053	like invit classi dinner soire not know anyon	2.0
6469	94170.0	4915	gener air exuber in benjamin hard resist	3.0
6470	87584.0	4547	philosophi illustr everyday event	2.5
6471	117304.0	6259	not onli comingofag stori cautionari parabl also perfectli render period piec	3.5
6472	45690.0	2221	ca nt wait see director doe next	3.5
6473	116971.0	6240	well check thi one out becaus straight up twin peak action	3.0
6474	118451.0	6329	power tell stori examin forbidden love racial tension issu valid today in 1950	3.5
6475	147899.0	8048	hiphop prison thriller stupefi absurd	1.0
6476	87459.0	4538	weird sake weird human natur ingrati grate	1.0
6477	131989.0	7115	noth one relentlessli depress situat anoth entir run time someth could easili deal right in live	1.0
6478	28618.0	1324	strong filmmak requir clear sens purpos in ohsoimport categori four feather come up short	0.5
6479	50494.0	2484	smart funni look arcan area popular cultur nt entir persuas doe give exposur talent perform	3.0
6480	20299.0	906	exist hush line like back	2.0
6481	130066.0	7005	rey directori debut ha good thing offer ultim undon sloppi script	1.0
6482	75266.0	3862	ha fun quirk famili life also treat subject fond respect	4.0
6483	104284.0	5502	few chuckl not singl gag sequenc realli score star seem in two differ movi	2.5
6484	5569.0	221	hi work transcend boymeetsgirl postur typic love stori	3.0
6485	69974.0	3561	premis smart execut pretti weari	1.0
6486	124200.0	6668	hart war ha much recommend even topbil willi not impress player	2.5
6487	16217.0	700	manag maintain level sophist intrigu humanscal charact suck audienc in	3.333333333333333
6488	119275.0	6375	simultan heartbreak veri funni last kiss realli perform	3.0
6489	129850.0	6991	result far alien involv	1.0
6490	87421.0	4535	seri messag make right choic in face tempt altern remain promin girl amus person	3.0
6491	24316.0	1105	everyon blame	1.0
6492	74010.0	3785	manag depress lead actor phone in hi autobiograph perform	1.3333333333333333
6493	152392.0	8316	despit strong perform never rise abov level telanovela	1.0
6494	118379.0	6323	question come mind whi thi bore	1.0
6495	75982.0	3900	one except everi blighter in thi particular south london hous project dig dysfunct like big comfort jar marmit slather cracker serv feast bleak	2.0
6496	53553.0	2656	sum fear pretend seriou explor nuclear terror realli noth warmedov cold war paranoia	0.0
6497	79637.0	4100	tough black man in america especi man ha taken away car workhour deni health insur	1.3333333333333333
6498	81046.0	4177	modern remak duma stori long narr lrb too rrb short action	1.0
6499	92365.0	4810	reggio glass rhapsod cynic repetit languor slomo sequenc glass dirgelik score becom fangbar lullabi	1.0
6500	50535.0	2485	make serial killer jeffrey dahmer bore	1.0
6501	149610.0	8143	dougla mcgrath nichola nicklebi doe dicken done cinemat	4.0
6502	76455.0	3928	kosminski put enough salt wound tortur selfconsci materi make sting	3.0
6503	150312.0	8187	jackson ha done proven no amount imagin no creatur no fantasi stori no incred outlandish sceneri	1.0
6504	94537.0	4935	actual compel look young woman tragic odyssey	2.0
6505	44460.0	2155	hatosi portray young brendan hi usual intellig subtleti not mention convinc brogu	3.0
6506	19290.0	847	worst thing chan ha done in unit state	0.0
6507	154775.0	8467	onehour mark herzog simpli run out idea pace turn posit leaden movi sputter inevit tragic conclus	0.0
6508	43108.0	2082	ell build gradual feel fulli embrac thi gentl comedi	3.0
6509	85376.0	4415	bedevil labor write slack direct	1.5
6510	14940.0	642	enough may pander basest desir payback unlik mani reveng fantasi ultim deliv	3.5
6511	100916.0	5300	made innoc yet fervid convict hollywood ha lost	2.25
6512	110561.0	5860	guess plot affection	3.0
6513	135087.0	7292	lack idol energi passion detail	1.0
6514	11118.0	477	puzzl experi	2.0
6515	2719.0	104	chang lane tri	3.0
6516	2683.0	103	epic also tragedi record tenaci human fighter wa also prison lrb ultim victim rrb histori	3.0
6517	76437.0	3927	stand fine sex onscreen tens argu not whole lot	2.0
6518	86281.0	4468	transcend agenda deliv aweinspir time sublim visual offer fascin glimps subcultur extrem athlet whose derringdo put x game	4.0
6519	38509.0	1836	wa fill shoot beat cuss could shake stick	1.3333333333333333
6520	111291.0	5901	far away	2.0
6521	22696.0	1028	true stori queen men allegedli inspir wa lot funnier deftli enact cobbl togeth onscreen	1.5
6522	124623.0	6697	appar writerdirector attal thought need onli cast hi moviestar wife sit around in drawer justifi film	1.0
6523	74451.0	3815	definit worth 95 minut time	3.5
6524	91236.0	4747	tone poem transgress	3.0
6525	153136.0	8362	seem everyth plagu human spirit in relentlessli global world	1.5
6526	122516.0	6571	replac john carpent stylish track shot degrad handheld blair witch videocam footag	1.0
6527	58988.0	2975	like mike stand out onli partli synthet decenc	2.5
6528	128369.0	6906	nt care fire win shot	1.5
6529	6291.0	251	in reassur manner beauti sung holiday carol	3.0
6530	139550.0	7571	cast keep thi pretti watchabl cast mick jagger director escort servic wa inspir	3.0
6531	112855.0	5993	rancid wellintent shamelessli manipul movi make	1.5
6532	116429.0	6209	tell stori in flat manner	1.5
6533	67537.0	3429	dash resourc hero lisp reptilian villain big fight big hair lavish period sceneri stori	4.0
6534	27574.0	1267	unexplor stori opportun punchdrunk love may work maker minimalist intent	2.0
6535	99418.0	5213	even seen stomp lrb stage show rrb still see thi	4.0
6536	46100.0	2241	noth interest in unfaith whatsoev	0.0
6537	7953.0	324	dread day in irish histori given passion somewhat flaw treatment	3.0
6538	136431.0	7376	fine perform make thi delic comingofag tale treat	4.0
6539	64112.0	3244	charm revolut os rather way introduc new fervent held idea fanci thinker	3.0
6540	46121.0	2244	mayb wa read mind audienc	3.0
6541	54087.0	2687	surround 86 minut overlyfamiliar poorlyconstruct comedi	0.5
6542	151100.0	8237	odditi sure one might wind up rememb degre affect rather revuls	3.0
6543	154173.0	8425	film vision sport secular religion bit cloy throughlin famili commun hearten in way season mark new start	3.0
6544	87278.0	4526	felt trap no obviou escap entir 100 minut	0.5
6545	120554.0	6447	film ha nearli termin case cute neither funni charm think	0.5
6546	152462.0	8320	payami tri rais seriou issu iran elector process	1.6666666666666667
6547	84200.0	4351	thi cinema pledg allegi cagney lacey	0.0
6548	4550.0	173	wallac get bit heavi hand hi messag time ha visual flair wax poetic far too much tast	2.0
6549	98629.0	5170	sometim thi modest littl number click sometim doe nt	2.0
6550	37192.0	1764	may well call jarjar bink movi	0.3333333333333333
6551	89867.0	4677	look play like 40 million version game like enjoy comput	0.75
6552	154738.0	8463	ensnar target audienc	2.333333333333333
6553	54573.0	2714	push slow spot reward fine act	3.0
6554	136618.0	7386	movi wear out make misti even nt	3.0
6555	3152.0	119	filmmak want noth els show us good time in cheap b movi way succeed	3.0
6556	78809.0	4056	thi movi refresh mind spirit along bodi origin content look style	4.0
6557	88926.0	4621	greg kinnear give mesmer perform fullfledg sex addict in complet denial hi obsess behavior	4.0
6558	2102.0	81	in pretti good execut stori lot richer one hollywood action screenwrit usual come up	3.0
6559	143947.0	7812	maryam time ever	3.0
6560	53939.0	2678	entir too straightfac transcend clever concept	1.5
6561	71789.0	3662	familiar enjoy	3.0
6562	93851.0	4896	nt steal harvard horribl movi onli grand failur	0.5
6563	147996.0	8056	cherri orchard badli edit often awkwardli direct suffer addit wholli unnecessari precredit sequenc design give charact back stori	1.0
6564	127880.0	6879	halloween thi visual unapp	0.0
6565	154986.0	8479	make one thing abundantli clear	2.5
6566	26435.0	1212	doubt thi listless featur win ani new viewer	1.0
6567	101581.0	5345	make movi special utter sincer	3.0
6568	37716.0	1794	bland pretenti mess	0.5
6569	128142.0	6894	come out nowher substitut mayhem suspens	2.0
6570	6144.0	245	robert harmon lessismor approach deliv real bumpin thenight chill hi greatest triumph keep creepi crawli hidden in film thick shadow	3.0
6571	104157.0	5493	rather bland	1.0
6572	107373.0	5674	sc2 autopilot hollywood concoct lack in imagin authent christma spirit yet gear toward audienc full master	1.0
6573	58389.0	2943	time machin journey back childhood care melt away in dark theater film abil mesmer astonish entertain	4.0
6574	138034.0	7467	though wa made care attent detail wellact jame spader maggi gyllenha felt disrespect	2.0
6575	96087.0	5020	lrb johnni wai ka fai rrb sure find enthusiast audienc among american actionadventur buff film interest may too narrow attract crossov viewer	1.0
6576	91062.0	4737	even botch enigma offer pleasur handsom wellmad entertain	3.0
6577	28595.0	1321	one thi kind movi	2.333333333333333
6578	60426.0	3052	mysteri enigma rich histor subject combin much firstrat talent could yield flat plod pictur	1.0
6579	54925.0	2735	realli dumb occasion realli funni	2.5
6580	45253.0	2200	flaw engross thriller	2.6666666666666665
6581	96144.0	5023	type film grow up nt see often enough day realist urgent not sugarco in least	3.5
6582	66277.0	3360	no thank	1.0
6583	155279.0	8500	feel like teenybopp ed wood film replet pubesc scandal innuendo highstrung flaccid drama	0.0
6584	52027.0	2567	respect uninspir thriller intellig consid in detail ultim weak in impact	2.0
6585	136210.0	7364	thi pictur murder number easi bore abc despit few whop shootout	0.0
6586	18237.0	797	tale passion tumultu affair musset unfold sand masculin persona love life beauti take form	3.0
6587	155083.0	8488	fizz busbi berkeley music viscer excit sport extravaganza	3.0
6588	137428.0	7435	music make nice album food entic itali beckon us	4.0
6589	109794.0	5817	quit achiev set shoot movi cann film festiv yet fail captur visual appeal atmospher	0.6666666666666666
6590	31439.0	1472	humor aspect jason x far entertain expect everyth els film tank	1.0
6591	129572.0	6968	refresh someon understand need bad boy diesel hi brawni frame cool compos deliveri fit bill perfectli	4.0
6592	155269.0	8499	goe down easi leav virtual no aftertast	2.5
6593	53020.0	2629	lrb davi rrb want caus hi audienc epiphani	2.0
6594	118959.0	6359	find moviego pleasur in tini event could make person ha live life halfasleep suddenli wake up take notic	3.0
