	PhraseId	SentenceId	Phrase	Sentiment
0	128011.0	6886	lrb macdowel rrb ventur beyond abil sever time reveal bad actress	0.0
1	101753.0	5357	thi absolut complet ridicul insult everi famili whose mother ha suffer horribl pain death cancer	0.0
2	49018.0	2394	film final hour nearli previou unseen materi resid unconvinc soap opera tornator wa right cut	1.0
3	88345.0	4589	film messag toler divers nt particularli origin one ca nt help drawn in sympathet charact	3.0
4	31757.0	1488	surest bet allaround good time movi thi summer	4.0
5	34218.0	1608	impuls produc thi project commend result uneven	1.5
6	70315.0	3583	cheapen overal effect	1.0
7	25467.0	1165	not make fun peopl not laugh	2.0
8	76211.0	3910	like igbi	2.0
9	33049.0	1549	find rhythm protect script bad idea awkward	1.5
10	5179.0	205	feel slight	2.0
11	148473.0	8079	act fine not enough substanc sustain interest full 90 minut especi weak payoff	1.5
12	790.0	29	vapid actor exercis appropri structur arthur schnitzler reigen	1.5
13	54215.0	2693	movi essenti seri fleetingli interest actor moment	2.0
14	18421.0	807	execr	0.0
15	99690.0	5230	clayburgh tambor charm perform neither deserv eric schaeffer	2.0
16	21964.0	984	red dragon never cut corner	3.5
17	131566.0	7090	few nonbeliev may rethink attitud see joy charact take in thi creed skeptic nt like enter theater	2.0
18	83031.0	4286	rymer doe nt trust laugh doe nt conjur proper respect follow whole deadundead genr deserv vampir pic few shrieki special effect	1.0
19	109693.0	5813	sort lowgrad dreck usual goe straight video lousi script inept direct pathet act poorli dub dialogu murki cinematographi complet visibl boom mike	0.0
20	103083.0	5434	move not infrequ breathtak film	3.6666666666666665
21	61176.0	3092	manag deliv fair bit vampir fun	2.5
22	4862.0	187	great deal corni dialogu preposter moment	0.6666666666666666
23	13001.0	560	peralta captur in lumin interview amazingli evoc film three decad ago essenc dogtown experi	4.0
24	45369.0	2205	whose aim extens accomplish seem decept slight surfac	2.0
25	65131.0	3295	creat new threat mib recycl premis	1.5
26	97860.0	5123	uneven selfconsci often hilari spoof	3.0
27	64567.0	3268	supposedli pokemon ca nt kill pokemon 4ever practic assur pocket monster movi franchis nearli readi keel over	1.0
28	116598.0	6218	gentl engross charact studi	3.0
29	56425.0	2831	fairli runofthemil	1.0
30	138229.0	7481	steven spielberg bring us anoth masterpiec	4.0
31	54813.0	2730	certainli clever in spot thi toolong spoofi updat shakespear macbeth doe nt sustain high enough level invent	1.0
32	143258.0	7777	concern overal feel broader idea openend question concret stori definit answer soderbergh solari gorgeou decept minimalist cinemat tone poem	4.0
33	126020.0	6770	black austin	1.5
34	155326.0	8502	mike leigh popul hi movi wonder ensembl cast charact bring routin day day struggl work class life	4.0
35	95598.0	4992	worri contract hi life	2.0
36	113200.0	6013	end up neither fail endeavor	0.3333333333333333
37	35312.0	1660	loos tie seri vignett onli prove zani doe nt necessarili mean funni	0.0
38	141962.0	7700	neither sappi big daddi anarch happi gilmor waterboy ha moment	2.5
39	38698.0	1844	complet contradict everyth kieslowski work aspir includ condit art	0.0
40	89657.0	4665	profan exploit offens action flick ever seen	0.0
41	91117.0	4741	kind parent enjoy intent introduc kid film caus load irrepar damag year year costli analysi could never fix one word decasia	0.0
42	150597.0	8208	like klein work rollerbal left us cold	0.5
43	37069.0	1757	exactli expect guy name kao	2.0
44	45927.0	2234	porki reveng ultim edit	2.0
45	15710.0	675	lrb dong rrb make valiant effort understand everyon point view doe good job famili fundament get rile up	4.0
46	154835.0	8470	huppert show steal make meal channel kathi baker creepi turn repress mother boston public much 8 women augustin	3.0
47	153009.0	8355	quietli move look back wa iranianamerican in 1979	3.0
48	119527.0	6390	entitl take deep bow fashion engross entertain out almost surefir prescript critic commerci disast	2.5
49	35981.0	1699	brilliant brutal uk crime film sinc jack carter went back newcastl first half gangster no 1 drip style time blood	4.0
50	123779.0	6646	like rocki bullwinkl speed neither complet enlighten doe catch intens movi strang	1.0
51	1981.0	74	work start finish	3.0
52	73925.0	3780	few modest laugh certainli no thrill	1.3333333333333333
53	39334.0	1878	good coburn oscar winner fact watch clumsili mug way snow dog seem inconceiv	1.0
54	62688.0	3171	stori rather simplist one grief drive love drive second chanc find love in unlik place struck chord in	3.0
55	126476.0	6801	first five minut talk til end year	3.0
56	106127.0	5605	fall short tension eloqu spiritu challeng thing made origin new testament stori compel 20 centuri	1.0
57	24635.0	1122	lrb hopkin rrb doe nt much phone in hi perform fax	0.5
58	78732.0	4051	bad baffl getgo	0.0
59	137930.0	7463	feel aimless much run time late in film tidal wave plot arriv leav question in wake	1.0
60	137142.0	7418	trailer park magnolia too long too cutesi too sure import possess peculiar tension too dens noth	1.0
61	107139.0	5661	interest psycholog game catandmous threedimension charact believ perform	3.0
62	5057.0	198	get impress writer director burr steer know territori hi sens humor ha yet lose smug selfsatisfact usual associ better privat school	2.0
63	43341.0	2095	jump around littl logic continu	1.0
64	75949.0	3897	thi uboat doe nt captain	1.0
65	78580.0	4042	doe nt think much charact protagonist us	1.0
66	19672.0	866	sword fight well done auteuil goofi pleasur	3.0
67	44950.0	2181	not everyth in thi ambiti comic escapad work coppola along hi sister sofia real filmmak	3.0
68	142589.0	7741	director georg hickenloop ha success documentari hi sens stori hi juvenil camera movement smack film school undergrad hi maudlin end might not gotten film school in first place	0.0
69	61404.0	3104	might easier watch video home nt stop diehard french film connoisseur go out enjoy bigscreen experi	3.0
70	76959.0	3958	in summer clone harvard man someth rare rivet wild ride reli special effect	4.0
71	1526.0	56	lead perform	2.25
72	145695.0	7920	star may colleg kid subject matter adult get temptat flesh unleash slightli craze overtli determin young woman onenight swim turn ocean troubl	3.0
73	144149.0	7825	fun wo nt feel cheat high infidel unfaith	3.0
74	116833.0	6233	film favor scientif over spectacular lrb visual speak rrb	2.0
75	128226.0	6900	in fair must report children vari age in audienc never cough fidget romp up down aisl bathroom break	3.0
76	51525.0	2538	anim backdrop lush invent yet return neverland never manag take us elus love place suspend disbelief	2.5
77	129239.0	6950	hard understand whi anybodi pick up	0.0
78	153188.0	8366	guy like someth mari american pie movi	2.0
79	98003.0	5134	leigh make live count	3.0
80	11102.0	474	polit potent	3.0
81	85965.0	4448	onesid documentari offer simplist explan veri complex situat	1.0
82	167.0	6	comedydrama nearli epic proport root in sincer perform titl charact undergo midlif crisi	4.0
83	56637.0	2845	smart not cloy	3.0
84	153489.0	8383	ponder whole segment popmus histori ha allow get wet fuzzi sticki	1.25
85	75197.0	3857	run time wait in vain movi happen	0.0
86	59995.0	3028	lrb deni rrb accomplish in hi chill unnerv film doubl portrait two young women whose live claustroph suffoc chilli attic inevit consign	3.0
87	131523.0	7087	one genuin sweet film come along in quit time	4.0
88	124902.0	6712	ha disadvantag also look cheap	0.0
89	113936.0	6057	like see seri perfect black pearl click togeth form string	2.6666666666666665
90	20110.0	893	probabl best case christian sinc chesterton lewi	3.0
91	111974.0	5944	pathet exploit film tri seem sincer seem wors effort	0.0
92	14850.0	639	filmmak eye detail high standard perform convey strong sens girl environ	3.0
93	54427.0	2705	thi long relentlessli saccharin film clear case preach convert	0.0
94	55884.0	2794	even though mani guy less ador lrb lament pretti much selfcent rrb someth vital movi	3.0
95	132839.0	7163	anim compet gag quit funni jonah never shake oppress moral superior goodfory qualiti almost automat accompani didact entertain	2.5
96	102677.0	5409	spi action flick antonio bandera luci liu never come togeth	0.5
97	87605.0	4549	plod look french revolut eye aristocrat	2.0
98	86750.0	4494	film idea wri comic mayhem	3.5
99	88668.0	4607	maryam small film offer larg reward	3.5
100	29394.0	1361	switch bodi funni person	2.0
101	152137.0	8300	messag caution children disturb world delic ecolog balanc	3.5
102	103122.0	5439	campanella compet direct hi excel cast overcom obstacl predict outcom screenplay gloss over rafael evolut	3.0
103	72096.0	3681	feel odd rest film	1.0
104	41599.0	2002	invest subtleti warmth in animatron bear	2.0
105	147614.0	8033	film brilliantli shine charact direct intellig accomplish	4.0
106	82235.0	4244	90 minut thi movi short feel much longer	1.0
107	147390.0	8020	film lack person permeat aspect tv movieesqu affect child act dullest irish pub scene ever film	0.0
108	37689.0	1792	richli entertain suggest ani number metaphor read	4.0
109	96663.0	5048	film fierc danc destruct	3.0
110	26386.0	1210	soso madefortv someth pose real movi	0.0
111	85544.0	4424	like blend shade lipstick compon combin one terrif stori lot laugh	4.0
112	4516.0	171	noth amiabl unfocus bagatel play like looselyconnect string actingworkshop exercis	0.5
113	100662.0	5285	muddi psycholog thriller rife miscalcul	1.0
114	41301.0	1982	pace film veri slow lrb obviou reason rrb too becom offput	1.5
115	59222.0	2989	postseptemb 11 sum fear seem tacki reprehens manipul collect fear without bestow subject intellig sincer unequivoc deserv	0.0
116	60499.0	3055	onc emot richli analyt cosbyseinfeld encount alon confirm seriou weight behind thi superfici loos larki documentari	2.0
117	60256.0	3043	one thing sure never come close either funni scari	0.5
118	136633.0	7387	compassion explor seemingli irreconcil situat conserv christian parent estrang gay lesbian children	3.0
119	13769.0	593	overli	2.0
120	152973.0	8351	intim contempl two marvel messi live	3.0
121	94908.0	4953	wonder lush morvern callar pure punk existenti ms ramsay cowrit liana dognini dramat alan warner novel felt like answer irvin welsh book trainspot	3.0
122	155015.0	8482	tell suppos ca nt realli call work art	1.3333333333333333
123	5542.0	220	film play thing nice n safe often play like milquetoast movi week blown up big screen	1.0
124	146358.0	7960	call thi full monti ice underdog sport team formula redux	2.0
125	24059.0	1094	despit hawaiian set sciencefict trim moment rowdi slapstick basic plot lilo could pull tearstain vintag shirley templ script	1.0
126	144329.0	7836	look moral famili social expect prism omnibu tradit call marriag	2.0
127	17938.0	781	essenti collect bit	2.0
128	71022.0	3621	one review	2.0
129	75376.0	3866	put mysteri scienc theatr 3000 tribut almost certainli go go down worst onli killer websit movi thi ani year	0.0
130	148209.0	8065	lrb madonna rrb deni athletic light emphas everi line sag	1.0
131	37571.0	1786	despit lag near finish line movi run good race one edg seat long stretch	3.0
132	112338.0	5966	almost noth els raunchi graphic may in present	2.0
133	144836.0	7863	movi mess start finish	1.0
134	49730.0	2439	never inspir interest detach	1.0
135	52627.0	2606	viewer nt get enough background charact involv individu rather type	2.0
136	151361.0	8252	pleasant forgett	2.0
137	81404.0	4197	exhaust famili drama porcelain empir hard flick subject matter	2.0
138	79109.0	4074	neglig work manipul exploit piec usual worst guilttrip parent	1.0
139	82673.0	4269	not stori work one thin scatter film work well enough make worth watch	3.0
140	58161.0	2932	combin sharp comedi oldfashion monster movi atmospher genuin heart creat film not mere kick undead also deal regret ultim find redempt	4.0
141	76879.0	3953	rose film true sourc materi provid tenaci demonstr death great equal	2.5
142	106463.0	5623	piec hot chick hilari schneider perform fine real shame much movi in anim slapdash mess	1.0
143	8076.0	332	lrb rrb mere stori point view film ice cold	1.0
144	23619.0	1073	compel comingofag drama arduou journey sensit young girl seri foster home fierc struggl pull free danger domin mother hold over	3.0
145	101129.0	5315	bray complet sea noth savag garden music video hi resum ha no clue make movi	0.0
146	67378.0	3420	full monti wa freshman fluke	1.0
147	36157.0	1708	rather averag action film benefit sever funni moment suppli epp	2.0
148	38788.0	1850	appet leav want	4.0
149	151286.0	8248	typic observ care nuanc intim french comingofag film encourag debut featur ha needlessli downbeat end too heavi ha preced	2.0
150	114293.0	6079	script too mainstream psycholog too textbook intrigu	1.0
151	96137.0	5022	kid lrb age rrb like adventur	3.0
152	113804.0	6049	encyclopedia clich shoplift shamelessli farewelltoinnoc movi like wander bronx tale without crib ani intellig	1.0
153	62393.0	3154	movi work admittedli limit extent commit two genuin engag perform	3.0
154	24886.0	1135	in emot seesaw hard figur depth two literari figur even time in live	1.0
155	86164.0	4460	worth see weaver lapaglia	3.0
156	39009.0	1861	nt laugh flee	2.0
157	141734.0	7689	witless utterli pointless	1.0
158	54463.0	2707	wife actress ha moment in look comic effect jealousi	4.0
159	14778.0	636	thi popcorn movi fun equal dose action chees ham cheek lrb well seriou debt road warrior rrb	2.5
160	50934.0	2507	feel untidili honest	2.0
161	71622.0	3654	less funni less funni think	0.0
162	106373.0	5617	almost unbear	0.0
163	68698.0	3491	behan memoir great materi film rowdi brawni lyric in best irish sens sheridan ha settl lugubri romanc	1.5
164	42225.0	2034	film deliv promis look wild ride ensu brash young men set out conquer onlin world laptop cell phone sketchi busi plan	3.0
165	73748.0	3772	not onli entri number twenti worst brosnan bunch one worst entir franchis	0.0
166	55416.0	2766	despit oldhat setup predict plot empir still ha enough moment keep entertain	3.0
167	49740.0	2440	comic dismal social realism farcic bawdi fantasi redempt regener	3.0
168	149298.0	8124	run mere 84 minut	2.0
169	151751.0	8281	take face stroke cheek coo beseechingli slow down shake tension take thi pictur breezi distract rhythm	3.0
170	121245.0	6493	not everi tast thi often veri funni collegi grossout comedi goe long way toward restor luster nation lampoon film franchis too long reduc directtovideo irrelev	3.0
171	138090.0	7471	cuaron repeatedli pervers undercut joie de vivr even creat give movi mourn undercurr place goodtim shenanigan in welcom perspect	4.0
172	62838.0	3180	fifti year fact world polit situat seem littl differ lrb director phillip rrb noyc bring out allegori remark skill	4.0
173	53908.0	2676	ask noth audienc sit back enjoy coupl great actor ham up	2.6666666666666665
174	73311.0	3745	thi one aim toilet score direct hit	0.0
175	127081.0	6835	onli thing distinguish randal wallac film ani fact noth distinguish in randal wallac film	0.0
176	114442.0	6087	aggriev	2.0
177	141111.0	7654	veri well made doe nt gener lot tension	2.0
178	19616.0	862	sitcomishli predict cloy in attempt poignant	1.5
179	107095.0	5658	mediterranean sparkl	3.0
180	34090.0	1602	gussi up mani distract special effect visual parti trick not clear whether suppos shriek laugh	1.0
181	14979.0	644	onli prospect beck next project	2.0
182	9879.0	413	bearabl	2.0
183	56698.0	2850	never capit thi concept opt breezi amateurish feel school special subject toler	0.0
184	129641.0	6973	thoroughli aw movi dumb narr chaotic visual sloppi weird amalgam thing geriatr scream	0.0
185	117225.0	6255	kung pow seem like futil concoct wa develop hastili oedekerk hi fellow moviemak got crash colleg keg parti	0.0
186	130725.0	7043	unnerv suspens find ring indisput spooki film screenplay die	3.5
187	126905.0	6823	brown sugar signal director rick famuyiwa emerg articul grownup voic in africanamerican cinema	3.0
188	94846.0	4948	anim drivel meant enhanc selfimag drool idiot	1.0
189	93067.0	4849	hard imagin act could ani flatter	0.0
190	74916.0	3841	got wildli popular vin diesel in equat	2.6666666666666665
191	58770.0	2963	heartwarm gentli comic even film break heart	3.5
192	113314.0	6022	success undercov brother found in abil spoof black white stereotyp equal	3.0
193	5935.0	237	riproar comedi action fest put hair chest	3.0
194	57075.0	2875	everyth wa superfici forc new jersey lowbrow accent uma	0.0
195	107940.0	5709	uplift onli document worst possibl mankind among best film year	4.0
196	80858.0	4168	sandler run empti repeat alreadi done way too often	1.0
197	129174.0	6946	littl supers infomerci cablesport channel summer x game	1.5
198	27527.0	1265	dazzl dream documentari	4.0
199	114344.0	6081	set in newfoundland cleverli captur dri wit preval rock	3.0
200	39869.0	1905	movi lack in action make up in drama suspens reveng romanc	3.0
201	36788.0	1743	problem neither origin present in convinc way	1.0
202	56146.0	2812	littl surpris	2.0
203	3348.0	126	mostli martha mostli unsurpris	1.5
204	117055.0	6245	wife plot noth special deliveri matter	2.5
205	120780.0	6463	film consid approach subject matter too calm thought agitprop thin character make failur straight drama	0.0
206	5144.0	203	latent gay like read hardli enough	2.0
207	51319.0	2527	inconsequenti roadandbuddi pic	1.0
208	68442.0	3473	lrb digit effect rrb remind terri gilliam rudimentari old monti python cartoon in would cut out figur draw photograph past togeth	2.0
209	144571.0	7848	oversex time overwrought comedydrama offer littl insight experi forti femal singl	0.0
210	114808.0	6111	go theater expect scari actionpack chiller might soon look sign	1.0
211	43125.0	2084	film ha problem short disappoint want stori go	3.0
212	113152.0	6011	firstclass road movi prove run away home ego problem go	3.5
213	107516.0	5681	uninterest	0.5
214	65310.0	3307	audienc saw thi one wa chuckl wrong time bad sign suppos collect heart attack	1.0
215	67856.0	3445	lrb unintent rrb terrifi	1.0
216	31983.0	1497	simpl tale unlik friendship thank gorgeou local except lead perform	4.0
217	87895.0	4565	heartbreak heartwarm simpl fabl done in artless sytl tremend move	3.5
218	58237.0	2934	routin rather silli	2.0
219	71090.0	3627	cumul effect movi repuls depress	0.0
220	80117.0	4128	result howev wellintent iron sort dispos kitchensink homag illustr whi whole often less sum part in today hollywood	0.0
221	149431.0	8134	upset thoughtprovok film ha odd puriti doe nt bring charact much ha studi	3.0
222	144213.0	7828	benigni present boy puppet pinocchio complet reced hairlin weather counten american breckin meyer ridicul inappropri valley boy voic	2.0
223	81506.0	4204	remind us beneath hype celebr high life conspiraci mysteri onc coupl bright young men promis talent charismat tragic doom	2.0
224	110419.0	5849	actor simpli too good stori too intrigu technic flaw get in way	4.0
225	108835.0	5762	get anoth phone call warn video nt back blockbust befor midnight go face frighten late fee	1.3333333333333333
226	60561.0	3058	young everlyn sampi courag molli craig simpli radiat starpow potenti in thi remark memor film	4.0
227	40858.0	1957	hi directori touch neither light magic enough bring thi kind whimsi	1.0
228	132184.0	7127	onc movi doe not proclaim truth two lovestruck somebodi permit time space convinc us	3.0
229	68894.0	3500	testament de niro director michael catonjon movi end accept charact film flaw	3.0
230	154280.0	8431	someth appear	2.0
231	16651.0	719	none birthday girl calcul event	2.0
232	148496.0	8080	tediou though ford neeson capabl hold interest not thrill movi	1.0
233	128443.0	6910	viewer barney crushingli selfindulg spectacl	1.0
234	54594.0	2715	make social commentari palat	2.5
235	30845.0	1435	pretti damn wonder	3.0
236	64232.0	3250	aimless actual sort amaz	3.0
237	114358.0	6082	bubbl up out john c walsh pipe dream distinct veri welcom sens watch intellig peopl make movi might actual want watch	3.0
238	29955.0	1389	few piec film buzz whir veri littl actual click	1.0
239	38846.0	1854	real antwon fisher wa abl overcom hi person obstacl becom good man	3.0
240	128947.0	6935	film strength nt in detail in larger pictur paint cultur in conflict thin veneer nation cover deepest mediasoak fear	2.5
241	74858.0	3838	movi thesi eleg technolog mass surprisingli refresh	3.0
242	111638.0	5925	head in hand wonder whi lee charact nt go bank manag save everyon miseri	1.0
243	140233.0	7610	soul unslick appar lrb aniston rrb ha alway need grow movi career	4.0
244	307.0	12	kung pow oedekerk realiz hi childhood dream in martialart flick prove sometim dream youth remain	1.0
245	115425.0	6150	take hatinhand approach rowl stifl creativ allow film drag nearli three hour	0.0
246	58089.0	2927	yu clearli hope camouflag bad hi movi	0.5
247	80329.0	4139	rich intellig film use pulpi core conceit probe question attract interdepend heart accomod practic need	4.0
248	35601.0	1678	cut core actual mean face fear girl in world boy boy truli in love girl ride big metaphor wave life wherev take	3.6666666666666665
249	86125.0	4458	especi compar televis seri inspir movi	2.0
250	92694.0	4829	clear mehta simpli want updat belov genr thousand indian fanci themselv too sophist cheeselac spectacl pack em in subcontin	2.0
251	21883.0	979	onli halfanhour long tv special humor would fast furiou nineti minut drag	1.0
252	64754.0	3279	realli bust out comfi littl cell	3.0
253	25283.0	1156	reminisc alfr hitchcock thriller scari part in sign occur wait thing happen	3.0
254	57886.0	2918	execut flop except six gag realli work	1.5
255	131595.0	7091	fred schepisi film pace speed slow us in middl age deathli slow ani teen	0.0
256	98008.0	5135	thi nice handl affair film human dark etch light lrb yet unsentiment rrb touch	3.0
257	35420.0	1667	nice casual intellig permeat script	3.0
258	5104.0	200	movi heavyhand screenplay navig fast fade pompos pretenti	2.0
259	54098.0	2688	sure contriv predict perform well tune film come winningli even though never solid want	3.0
260	149930.0	8166	grew up scoobi love thi movi	3.0
261	68523.0	3477	arni blow thing up	2.0
262	125664.0	6752	see befor inevit hollywood remak flatten out odd intrigu wrinkl	2.0
263	59547.0	3003	cyber hymn cruel stori youth cultur	2.0
264	47519.0	2317	passion irrat longsuff cruel tarantula helga figur promin in thi movi help keep proceed funni grownup rugrat	3.0
265	84095.0	4344	straightforward oldfashion in best possibl sens word	4.0
266	23707.0	1077	jacquot preserv tosca intox ardor hi use camera	2.5
267	16909.0	733	ha few moment insight enough fondli rememb in endlessli challeng maze moviego	3.0
268	83727.0	4328	pray doe nt passion materi	1.0
269	69261.0	3520	sheer unbridl delight in way stori unfurl	3.0
270	54238.0	2695	actionthril finest kind evok memori day jackal french connect heat	4.0
271	136509.0	7381	appropri tale unfold like lazi summer afternoon conclud crisp clariti fall dawn	3.0
272	114151.0	6070	paul bettani cool	3.0
273	153889.0	8407	termin brain dead product	0.0
274	105323.0	5562	entertain in love overinfl mytholog no longer recogn need moviego real charact compel plot	1.0
275	106563.0	5628	like kubrick soderbergh nt afraid tri ani genr hi way	3.0
276	86603.0	4485	doe give tast burn man etho appeal blend countercultur ideal hedonist creativ	3.5
277	66802.0	3390	slap protagonist geneviev leplouff becaus french	2.0
278	60453.0	3053	could someth special two thing drag down mediocr director clare peplo misunderstand marivaux rhythm mira sorvino limit classic actress	0.0
279	34383.0	1614	onli teenag boy could possibl find funni	1.0
280	10723.0	455	maelstrom deliber unsteadi mixtur stylist element	2.0
281	62289.0	3149	imagin lrb possibl rrb pasolini film without passion polit almodovar movi without beauti humor	1.0
282	52048.0	2568	worst movi year	0.5
283	150415.0	8195	mani thing solid act movi craft someth promis mediocr screenplay not one	1.5
284	117776.0	6289	put rest ani thought german film industri not make delight comedi center food	4.0
285	37125.0	1760	ash wednesday essenti devoid interest charact even halfway intrigu plot	1.0
286	125820.0	6759	exercis in formula crashandbash action	1.5
287	7422.0	302	use stock plot boy inject enough fresh proceed provid enjoy 100 minut in movi theater	3.0
288	147448.0	8023	clich noth could appropri	2.0
289	98597.0	5167	third time charm yeah babi	4.0
290	147171.0	8008	littl violenc lot sex in bid hold attent grow monoton joan philip repetit argument scheme treacheri	1.0
291	151230.0	8245	gener audienc might not come away greater knowledg fact cuban music	1.5
292	84816.0	4387	granddad le nouvel vagu jeanluc godard continu baffl faith hi game hideandseek	2.0
293	31028.0	1446	entir suspens extrem wellpac ultim dare say entertain	4.0
294	109539.0	5803	unbear lame	0.0
295	28959.0	1342	call cynic someth aw deadli ani movi lifeaffirm messag	1.5
296	49406.0	2419	veri familiar tale one told countless filmmak italian chines irish latin indian russian hyphen american young men struggl balanc conflict cultur messag	2.0
297	64330.0	3256	refresh drink woodland stream	3.0
298	5367.0	215	director bori von sychowski instead opt routin slasher film wa probabl fun make sit	2.0
299	25486.0	1166	resent betti manipul yet needi margot front center	2.0
300	16342.0	704	interest wit conflict palestinian side longley film lack balanc fail put struggl meaning histor context	1.0
301	77141.0	3968	glossi knockoff bmovi reveng flick	2.0
302	6392.0	254	comput anim handsom variou amus sidekick add muchneed leviti otherwis bleak tale overal film never rise abov mediocr	1.5
303	128337.0	6905	hanukkah spirit seem fri in pork	1.0
304	145796.0	7925	satisfi kid flck becom increasingli implaus race contriv plot point	1.0
305	144263.0	7830	come pantomimesqu sterotyp	1.0
306	71927.0	3673	shot like postcard overact boozi selfindulg bring out worst in otherwis talent actor	0.0
307	87523.0	4542	despit hoffman best effort wilson remain silent lumpish cipher hi encount reveal noth wa befor	1.5
